Book	Chapter	Verse	ID	SupportReference	OrigQuote	Occurrence	GLQuote	OccurrenceNote
ROM	4	20	a4g4	figs-metaphor	ἐνεδυναμώθη τῇ πίστει	1		Paul parle au sens figuré de la **foi d'Abraham** comme s'il s'agissait de quelque chose dans laquelle une personne pourrait être **renforcée**>. Il veut dire que Dieu a permis à Abraham de continuer à lui faire confiance. Si cela risque d'embrouiller vos lecteurs, vous pouvez exprimer le sens de manière simple. Traduction alternative : "a été rendu capable de continuer à faire confiance" (Voir : [[rc://en/ta/man/translate/figs-metaphor]])

ROM	4	20	ew3r	figs-abstractnouns	δοὺς δόξαν τῷ Θεῷ	1		Si votre langue n'utilise pas de nom abstrait pour l'idée de **gloire**, vous pouvez exprimer la même idée avec une forme verbale. Traduction alternative : "ayant glorifié Dieu" (Voir : [[rc://en/ta/man/translate/figs-abstractnouns]])

ROM	4	21	y2sh	figs-activepassive	πληροφορηθεὶς	1	He was fully convinced	Si votre langue n'utilise pas la forme passive de cette manière, vous pourriez exprimer l'idée à la forme active ou d'une autre manière qui est naturelle dans votre langue. Si vous devez préciser qui a fait l'action, Paul implique que "Dieu" l'a fait. Autre traduction : "Dieu l'a pleinement convaincu" (Voir : [[rc://en/ta/man/translate/figs-activepassive]])

ROM	4	21	plbf	writing-pronouns	ἐπήγγελται…ἐστιν	1		Le pronom **il** se réfère à Dieu, pas à Abraham. Si cela risque de troubler vos lecteurs, vous pourriez le préciser explicitement. Traduction alternative : "Dieu avait promis, Dieu est" (Voir : [[rc://en/ta/man/translate/writing-pronouns]])

ROM	4	21	j12r	writing-pronouns	ὃ ἐπήγγελται	1		Ici, **ce qu'il avait promis** fait référence à la promesse que Paul décrit au [verset 13](../04/13.md). Si cela risque de troubler vos lecteurs, vous pourriez le préciser explicitement. Traduction alternative : "les choses que Dieu a promises à Abraham" (Voir : [[rc://en/ta/man/translate/writing-pronouns]])

ROM	4	22	ympp	grammar-connect-logic-result	διὸ καὶ	1		Ici, **donc** introduit une clause de résultat. Utilisez un moyen naturel dans votre langue pour indiquer le résultat. Traduction alternative : "And for this reason" ou "And this is the reason why" (Voir : [[rc://en/ta/man/translate/grammar-connect-logic-result]])

ROM	4	22	wlnh	figs-quotemarks	ἐλογίσθη αὐτῷ εἰς δικαιοσύνην	1		Cette clause est une citation de [Genèse 15:6](../../gen/15/06.md). Il peut être utile à vos lecteurs de l'indiquer par des guillemets ou par toute autre ponctuation ou convention utilisée dans votre langue pour indiquer les citations. (Voir : [[rc://en/ta/man/translate/figs-quotemarks]])

ROM	4	22	i56a	figs-activepassive	ἐλογίσθη αὐτῷ εἰς δικαιοσύνην	1	Therefore this was also counted to him as righteousness	Voyez comment vous avez traduit cela dans [le verset 3](../04/03.md). (Voir : [[rc://en/ta/man/translate/figs-activepassive]])

ROM	4	23	zdc0	figs-infostructure	οὐκ ἐγράφη…δι’ αὐτὸν μόνον, ὅτι ἐλογίσθη αὐτῷ	1	Therefore this was also counted to him as righteousness	Si cela est plus naturel dans votre langue, vous pouvez inverser l'ordre de ces phrases et les combiner. Traduction alternative : "Or, la phrase 'on lui a compté' n'a pas été écrite seulement pour lui" (Voir : [[rc://en/ta/man/translate/figs-infostructure]]).

ROM	4	23	r65c	writing-pronouns	αὐτὸν…αὐτῷ	1	only for his benefit	Les pronoms **son** et **lui** font référence à Abraham. Si cela risque de troubler vos lecteurs, vous pourriez le préciser explicitement. Traduction alternative : "Abraham's ... to him" (Voir : [[rc://en/ta/man/translate/writing-pronouns]])

ROM	4	23	bfiw	figs-activepassive	οὐκ ἐγράφη…δι’ αὐτὸν μόνον	1		Si votre langue n'utilise pas la forme passive de cette manière, vous pourriez exprimer l'idée à la forme active ou d'une autre manière qui est naturelle dans votre langue. Si vous devez préciser qui a fait l'action, Moïse a écrit la citation. Traduction alternative : "Moïse ne l'a pas écrite seulement pour l'amour d'Abraham" (Voir : [[rc://en/ta/man/translate/figs-activepassive]])

ROM	4	23	bmlm		δι’ αὐτὸν	1		Traduction alternative : "pour lui" ou "concernant lui"

ROM	4	23	ae1u	figs-quotemarks	ὅτι ἐλογίσθη αὐτῷ,	1		Cette clause est une citation de [Genèse 15:6](../../gen/15/06.md). Il peut être utile à vos lecteurs de l'indiquer par des guillemets ou par toute autre ponctuation ou convention utilisée dans votre langue pour indiquer les citations. (Voir : [[rc://en/ta/man/translate/figs-quotemarks]])

ROM	4	23	jft0	figs-activepassive	ἐλογίσθη αὐτῷ	1		Voyez comment vous avez traduit cela dans le verset précédent. (Voir : [[rc://en/ta/man/translate/figs-activepassive]])

ROM	4	24	pfc9	figs-exclusive	δι’ ἡμᾶς, οἷς μέλλει λογίζεσθαι, τοῖς πιστεύουσιν ἐπὶ τὸν ἐγείραντα Ἰησοῦν, τὸν Κύριον ἡμῶν, ἐκ νεκρῶν	1	for us	Ici, **notre** et **qui** désignent tous **ceux qui croient** en **Jésus**. Votre langue peut vous demander de marquer ces formes. Traduction alternative : "pour nous, les croyants qui sont sur le point d'être comptés, à nous qui croyons en celui qui a ressuscité d'entre les morts, Jésus, le Seigneur de nous tous" (Voir : [[rc://en/ta/man/translate/figs-exclusive]]).

ROM	4	24	ffdm		δι’ ἡμᾶς	1		Voyez comment vous avez traduit "pour son bien" dans le verset précédent.

ROM	4	24	nh4k	figs-activepassive	οἷς μέλλει λογίζεσθαι	1	also for us, for whom it will be counted, we who believe	Si votre langue n'utilise pas la forme passive de cette manière, vous pourriez exprimer l'idée à la forme active ou d'une autre manière qui est naturelle dans votre langue. Si vous devez indiquer qui fera l'action, Paul implique que "Dieu" la fera. Traduction alternative : "à qui Dieu va le compter" (Voir : [[rc://en/ta/man/translate/figs-activepassive]])

ROM	4	24	bu1m	writing-pronouns	μέλλει	1		Ici, le pronom **il** fait référence à la "foi" mentionnée dans [les versets 5](../04/05) et [20](../04/20). Auparavant, **il** faisait référence à la foi d'Abraham, mais dans ce verset **il** fait référence à **notre** foi. Si cela risque de troubler vos lecteurs, vous pourriez le préciser explicitement. Traduction alternative : "notre foi est sur" (Voir : [[rc://en/ta/man/translate/writing-pronouns]])

ROM	4	24	mujr		λογίζεσθαι	1		Voyez comment vous avez traduit **> compté <** dans le verset précédent.

ROM	4	24	artt	figs-explicit	τὸν ἐγείραντα Ἰησοῦν, τὸν Κύριον ἡμῶν, ἐκ νεκρῶν	1		Cette clause fait référence à Dieu. Si cela peut prêter à confusion pour vos lecteurs, vous pouvez indiquer le sens de manière explicite. Traduction alternative : "Dieu qui a ressuscité Jésus notre Seigneur d'entre les morts" (Voir : [[rc://en/ta/man/translate/figs-explicit]])

ROM	4	24	i6vl	figs-idiom	ἐγείραντα Ἰησοῦν, τὸν Κύριον ἡμῶν	1		Ici, **soulevé** est une expression idiomatique pour dire que quelqu'un qui est mort redevient vivant. Si vos lecteurs comprenaient mal cette expression, vous pourriez en exprimer le sens clairement. Traduction alternative : "qui a fait revivre Jésus notre Seigneur" (Voir : [[rc://en/ta/man/translate/figs-idiom]])

ROM	4	24	iq69	figs-idiom	ἐκ νεκρῶν	1		Ici, l'expression traduite **les morts** fait référence aux personnes mortes. Ici, elle signifie que Jésus est mort physiquement et a été enterré. Si votre langue a un mot ou une expression pour désigner l'endroit où vont les morts, vous pourriez l'utiliser ici. Traduction alternative : "de l'endroit où se trouvent les morts" (Voir : [[rc://en/ta/man/translate/figs-idiom]])

ROM	4	25	irue	writing-pronouns	ὃς…ἡμῶν…τὴν δικαίωσιν ἡμῶν	1		Ici, le pronom **qui** se réfère à Jésus, et **notre** se réfère à tous "ceux qui croient" en lui, comme mentionné dans le verset précédent. Si cela risque de troubler vos lecteurs, vous pourriez le préciser explicitement. Traduction alternative : "Jésus ... la justification de nous autres croyants" (Voir : [[rc://en/ta/man/translate/writing-pronouns]]).

ROM	4	25	cca1	figs-activepassive	ὃς παρεδόθη…ἠγέρθη	1	who was delivered up for our trespasses and was raised for our justification	Si votre langue n'utilise pas la forme passive de cette manière, vous pourriez exprimer l'idée à la forme active ou d'une autre manière qui est naturelle dans votre langue. Si vous devez préciser qui a fait l'action, Paul implique que "Dieu" l'a fait. Traduction alternative : "que Dieu a abandonné... Dieu a ressuscité" (Voir : [[rc://en/ta/man/translate/figs-activepassive]])

ROM	4	25	b999	figs-metaphor	ὃς παρεδόθη	1		Paul parle de Jésus au sens figuré, comme s'il était une chose qui pouvait être **cédée** à une autre personne. Paul veut dire que Dieu a permis à des gens d'arrêter et de tuer Jésus. Si vos lecteurs ne comprendraient pas cela, vous pourriez exprimer le sens en clair. Traduction alternative : "qui a été autorisé à être tué" (Voir : [[rc://en/ta/man/translate/figs-metaphor]])

ROM	4	25	op41	figs-abstractnouns	διὰ τὰ παραπτώματα ἡμῶν…διὰ τὴν δικαίωσιν ἡμῶν	1		Si votre langue n'utilise pas de noms abstraits pour ces idées de **offenses** et **justification**, vous pourriez exprimer les mêmes idées avec des formes verbales. Traduction alternative : " parce que nous avons commis une infraction... pour nous rendre justes " (voir : [[rc://en/ta/man/translate/figs-abstractnouns]]).

ROM	4	25	imvc	grammar-connect-logic-result	διὰ τὰ παραπτώματα ἡμῶν	1		Ici, Paul utilise **pour le bien de** différemment de ce qu'il a fait dans [les versets 23-24](../04/23.md). Ici, Paul utilise cette expression pour indiquer la raison pour laquelle Jésus **a été abandonné**. Si cela risque de troubler vos lecteurs, vous pourriez le préciser explicitement. Traduction alternative : "à cause de nos offenses" (Voir : [[rc://en/ta/man/translate/grammar-connect-logic-result]])

ROM	4	25	gmbd	figs-idiom	ἠγέρθη	1		Voyez comment vous avez traduit **relevé** dans le verset précédent. (Voir : [[rc://en/ta/man/translate/figs-idiom]])

ROM	4	25	hzop	grammar-connect-logic-goal	διὰ τὴν δικαίωσιν ἡμῶν	1		Ici, Paul utilise **pour le bien de** différemment de ce qu'il a fait dans la première partie de ce verset. Ici, Paul utilise cette expression pour indiquer l'un des objectifs de Jésus étant **ressuscité**. Si cela risque de troubler vos lecteurs, vous pourriez le préciser explicitement. Traduction alternative : "dans le but de notre justification" (Voir : [[rc://en/ta/man/translate/grammar-connect-logic-goal]])

ROM	5	intro	i1dt			0		# Romains 5 Notes générales<br><br>## Structure et mise en forme<br><br>4. La justice est reçue par Jésus-Christ en mettant sa confiance en lui (3:21-5:21)<br> * La justice de Dieu est reçue par la foi (3:21-26)<br> * Personne ne peut se vanter des œuvres (3:27-31)<br> * Les exemples d'Abraham et de David (4 :1-25)<br> * Les bénédictions de la justification (5 : 1-11)<br> * Adam et Christ sont comparés (5 : 12-5 : 21)<br><br>## Notions particulières à ce chapitre<br><br>### Le deuxième Adam<br><br>Adam était le premier homme et le premier "fils" de Dieu. Il a été créé par Dieu. Il a introduit le péché et la mort dans le monde en mangeant le fruit défendu. Dans ce chapitre, Paul décrit Jésus comme le "second Adam" et le véritable fils de Dieu. Jésus apporte la vie éternelle et a vaincu le péché et la mort en mourant sur la croix. (Voir : [[rc://en/tw/dict/bible/kt/sonofgod]] et [[rc://en/tw/dict/bible/other/death]])<br><br>## Autres difficultés de traduction possibles dans ce chapitre<br><br>Dans ce chapitre, les pronoms "nous", "notre" et "nos" font référence inclusivement à tous les croyants en Christ. Paul appelle ces personnes celles qui ont été "justifiées par la foi" au [verset 1](../05/01.md). Votre langue peut vous obliger à marquer ces formes. (Voir : [[rc://en/ta/man/translate/figs-exclusive]])

ROM	5	1	age4	grammar-connect-words-phrases	οὖν	1		**Donc**, marque ici une nouvelle section de la lettre. Il introduit également une clause de résultat qui résume les résultats bénis d'une personne qui devient juste en faisant confiance à Jésus, dont Paul vient de parler dans [1:18](../01/18.md)-[4:25](../04/25.md). Utilisez un moyen naturel dans votre langue pour indiquer le résultat. Traduction alternative : " Puisque toutes ces choses sont vraies " ou " En conséquence de tout ce que je viens de vous dire étant vrai " (Voir : [[rc://en/ta/man/translate/grammar-connect-words-phrases]]).

ROM	5	1	xmp3	grammar-connect-logic-result	δικαιωθέντες…ἐκ πίστεως, εἰρήνην ἔχωμεν πρὸς τὸν Θεὸν, διὰ τοῦ Κυρίου ἡμῶν, Ἰησοῦ Χριστοῦ	1		Si cela était plus naturel dans votre langue, vous pourriez inverser l'ordre de ces phrases, puisque la deuxième phrase donne la raison du résultat que la première décrit. Traduction alternative : " Ayons la paix avec Dieu par notre Seigneur Jésus-Christ, puisque nous avons été justifiés par la foi " ou " Nous pouvons avoir la paix avec Dieu par notre Seigneur Jésus-Christ, puisque nous avons été justifiés par la foi " (Voir : [[rc://en/ta/man/translate/grammar-connect-logic-result]]).

ROM	5	1	xott	figs-activepassive	δικαιωθέντες	1		Si votre langue n'utilise pas la forme passive de cette manière, vous pourriez exprimer l'idée à la forme active ou d'une autre manière qui est naturelle dans votre langue. Si vous devez préciser qui a fait l'action, Paul implique que "Dieu" l'a fait. Traduction alternative : " parce que Dieu nous rend justes " ou " puisque Dieu nous rend justes avec lui " (Voir : [[rc://en/ta/man/translate/figs-activepassive]]).

ROM	5	1	wbwx	figs-abstractnouns	ἐκ πίστεως	1		Voyez comment vous avez traduit cette phrase dans [4:16](../04/16.md). (Voir : [[rc://en/ta/man/translate/figs-abstractnouns]])

ROM	5	1	ldru	translate-textvariants	εἰρήνην ἔχωμεν	1		Certaines copies anciennes disent "nous avons la paix", ce qui est logique, puisque [les versets 1-5](../05/01.md) sont une liste de bénédictions qui appartiennent aux personnes qui ont été **justifiées par la foi**. Si la lecture **ayons la paix** est correcte, cette phrase peut indiquer le désir de Paul que ses coreligionnaires continuent à expérimenter la paix qu'ils ont avec Dieu. Si une traduction de la Bible existe déjà dans votre région, vous pourriez envisager d'utiliser la lecture dans cette traduction. S'il n'existe pas encore de traduction de la Bible dans votre région, nous vous recommandons de suivre les lectures de l'ULT et de l'UST. (Voir : [[rc://en/ta/man/translate/translate-textvariants]])

ROM	5	1	kjpb	figs-imperative	ἔχωμεν	1		Paul utilise la phrase **ayons la paix** pour exhorter ses lecteurs chrétiens à continuer à vivre en paix avec Dieu. Il ne s'agit pas d'un commandement. Cette phrase n'implique pas que ceux qui ont été **justifiés par la foi** n'ont pas encore la paix avec Dieu. Utilisez une forme dans votre langue qui communique une exhortation. Traduction alternative : "nous devons continuer à avoir" (Voir : [[rc://en/ta/man/translate/figs-imperative]])

ROM	5	1	hi12	figs-abstractnouns	εἰρήνην ἔχωμεν	1		Si votre langue n'utilise pas de nom abstrait pour l'idée de **paix**, vous pouvez exprimer la même idée avec une forme verbale, comme dans l'UST. (Voir : [[rc://en/ta/man/translate/figs-abstractnouns]])

ROM	5	1	o2yr	figs-metaphor	εἰρήνην ἔχωμεν	1		Paul parle au sens figuré de ces personnes comme si elles pouvaient posséder ou avoir **la paix**>. Il veut dire qu'elles peuvent vivre en paix avec Dieu. Si vos lecteurs ne comprendraient pas ce que **avoir la paix** signifie dans ce contexte, vous pourriez exprimer le sens de manière simple. Traduction alternative : "vivons en paix" (Voir : [[rc://en/ta/man/translate/figs-metaphor]])

ROM	5	1	s6xd	figs-exclusive	ἔχωμεν…ἡμῶν	1	we … our	Ici et tout au long de ce chapitre, les pronoms **nous** et **notre** se réfèrent inclusivement à tous ceux **qui ont été justifiés par la foi** en Jésus. Si cela peut prêter à confusion pour vos lecteurs, vous pourriez indiquer le sens de manière explicite. Traduction alternative : "let us believers ... our" (Voir : [[rc://en/ta/man/translate/figs-exclusive]])

ROM	5	1	xaeg	figs-explicit	διὰ τοῦ Κυρίου ἡμῶν, Ἰησοῦ Χριστοῦ	1		Ici, **par** indique que **notre Seigneur Jésus-Christ** est le moyen par lequel les croyants ont **la paix avec Dieu**. Cela fait référence à ce que Jésus a fait pour les croyants afin qu'ils aient **la paix avec Dieu**, comme mentionné brièvement dans [4:25](../04/25.md). Si cela risque de troubler vos lecteurs, vous pourriez le préciser explicitement. Traduction alternative : " par ce que notre Seigneur Jésus-Christ a fait pour nous " ou " ce qui a été causé par notre Seigneur Jésus-Christ " (voir : [[rc://en/ta/man/translate/figs-explicit]]).

ROM	5	2	slyh	figs-abstractnouns	δι’ οὗ καὶ τὴν προσαγωγὴν ἐσχήκαμεν, τῇ πίστει εἰς τὴν χάριν ταύτην, ἐν ᾗ ἑστήκαμεν	1		Si votre langue n'utilise pas de noms abstraits pour les idées de **accès**, **foi**, ou **grâce**, vous pourriez exprimer les mêmes idées d'une autre manière. Traduction alternative : " par lequel nous accédons aussi et nous tenons dans la grâce de Dieu en nous confiant en lui " (Voir : [[rc://en/ta/man/translate/figs-abstractnouns]]).

ROM	5	2	tsbo	writing-pronouns	οὗ	1		Le pronom **qui** fait référence à "notre Seigneur Jésus-Christ", comme mentionné dans le verset précédent. Si cela risque de troubler vos lecteurs, vous pourriez le préciser explicitement. Traduction alternative : "par notre Seigneur Jésus-Christ" (Voir : [[rc://en/ta/man/translate/writing-pronouns]])

ROM	5	2	i50u	figs-exclusive	καὶ…ἐσχήκαμεν…ἑστήκαμεν…καυχώμεθα	1		Le pronom **nous** dans ce verset se réfère inclusivement à tous les croyants en Christ. Voir la discussion à ce sujet dans les notes générales de ce chapitre. Traduction alternative : "Nous, les croyants, nous avons aussi... nous, les croyants, nous sommes debout... nous, les croyants, nous nous glorifions" (voir : [[rc://en/ta/man/translate/figs-exclusive]]).

ROM	5	2	af0n	figs-metaphor	εἰς τὴν χάριν ταύτην, ἐν ᾗ ἑστήκαμεν	1		Paul parle au sens figuré de **la grâce** comme s'il s'agissait d'un lieu auquel quelqu'un pouvait accéder et se tenir à l'intérieur. Il veut dire que la confiance en Jésus permet aux croyants d'expérimenter avec confiance la grâce de Dieu envers son peuple. Si vos lecteurs ne comprendraient pas cela, vous exprimez le sens de façon claire. Traduction alternative : "expérimenter en toute confiance la bonté de Dieu" ou "expérimenter en toute sécurité la grâce de Dieu" (Voir : [[rc://en/ta/man/translate/figs-metaphor]])

ROM	5	2	dxcu	figs-abstractnouns	καυχώμεθα ἐπ’ ἐλπίδι τῆς δόξης τοῦ Θεοῦ	1		Si votre langue n'utilise pas de noms abstraits pour les idées de **espoir et **gloire**, vous pourriez exprimer les mêmes idées d'une autre manière. Traduction alternative : "nous pouvons nous vanter parce que nous avons la certitude que nous serons glorifiés avec Dieu" (Voir : [[rc://en/ta/man/translate/figs-abstractnouns]]).

ROM	5	2	zp5p	figs-possession	τῆς δόξης τοῦ Θεοῦ	1		Paul utilise des formes possessives pour décrire comment **gloire** se rapporte à **Dieu**. Cela pourrait se référer à : (1) la gloire que Dieu partage avec les croyants. C'est la même gloire que Dieu a partagée avec les humains lorsqu'il les a créés, mais qu'ils ont perdue lorsque les premiers humains ont péché, comme mentionné dans [3:23](../03/23.md). Traduction alternative : "(2) glorifier Dieu, comme dans la phrase similaire " la gloire du Dieu impérissable " dans [1:23](../01/23.md). Traduction alternative : "de glorifier Dieu" (Voir : [[rc://en/ta/man/translate/figs-possession]])

ROM	5	3	q5p7	writing-pronouns	οὐ μόνον δέ	1	Not only this	Le pronom **ce** ici fait référence à la vantardise de "l'espérance de la gloire de Dieu", comme mentionné dans le verset précédent. Si cela risque de troubler vos lecteurs, vous pourriez le préciser explicitement. Traduction alternative : " Et nous ne nous glorifions pas seulement sur la base de l'espérance de la gloire de Dieu " (Voir : [[rc://en/ta/man/translate/writing-pronouns]]).

ROM	5	3	c644	figs-metaphor	καὶ καυχώμεθα ἐν ταῖς θλίψεσιν	1		Ici, **dans nos souffrances** pourrait signifier : (1) les croyants peuvent **se vanter** de leurs **souffrances**. Traduction alternative : "nous pouvons aussi nous vanter de nos souffrances" (2) les croyants peuvent se vanter alors qu'ils vivent des **souffrances**. Traduction alternative : "nous pouvons aussi nous vanter lorsque nous sommes en détresse" (Voir : [[rc://en/ta/man/translate/figs-metaphor]]).

ROM	5	3	xeak	grammar-connect-logic-result	εἰδότες	1		Ici, **savoir** indique que ce qui suit dans ce verset et le verset suivant sont les raisons pour lesquelles les croyants peuvent **se vanter de nos souffrances**. Si cela risque de troubler vos lecteurs, vous pourriez le dire explicitement. Traduction alternative : "puisque nous savons" (Voir : [[rc://en/ta/man/translate/grammar-connect-logic-result]])

ROM	5	3	c0rl	figs-abstractnouns	ἐν ταῖς θλίψεσιν…ἡ θλῖψις…ὑπομονὴν	1		Si votre langue n'utilise pas de noms abstraits pour les idées de **souffrances**, **souffrance**, et **endurance**, vous pourriez exprimer les mêmes idées avec des formes verbales. Traduction alternative : " quand on souffre... quand on souffre... une façon d'endurer " (Voir : [[rc://en/ta/man/translate/figs-abstractnouns]]).

ROM	5	3	vmbf	figs-litany	ἡ θλῖψις ὑπομονὴν κατεργάζεται	1		Paul utilise une série répétitive de clauses dans cette clause et le verset suivant pour montrer combien de raisons il y a pour les chrétiens de se vanter de leur souffrance. Ce style répétitif de parler ou d'écrire s'appelle une "litanie". Utilisez une forme dans votre langue que quelqu'un utiliserait pour énumérer une série de raisons pour quelque chose. (Voir : [[rc://en/ta/man/translate/figs-litany]])

ROM	5	3	lo57	figs-metaphor	ἡ θλῖψις ὑπομονὴν κατεργάζεται	1		Paul parle au sens figuré de **l'endurance** comme si c'était un objet que l'on pouvait produire. Il veut dire que lorsque les chrétiens se confient en Dieu tout en **souffrant**>, ils développent une plus grande **endurance** qu'ils n'en avaient avant d'expérimenter **la souffrance**. Si cela risque de troubler vos lecteurs, vous pourriez exprimer le sens de manière plus claire. Traduction alternative : " cette souffrance nous aide à savoir comment endurer " (Voir : [[rc://en/ta/man/translate/figs-metaphor]]).

ROM	5	4	w7c2	figs-ellipsis	ἡ δὲ ὑπομονὴ δοκιμήν, ἡ δὲ δοκιμὴ ἐλπίδα	1		Paul omet certains des mots dont une phrase aurait besoin dans de nombreuses langues pour être complète. Si cela devait être mal compris dans votre langue, vous pourriez fournir ces mots à partir du contexte. Traduction alternative : "et l'endurance produit le caractère, et ce caractère produit l'espérance" (Voir : [[rc://en/ta/man/translate/figs-ellipsis]])

ROM	5	4	dt8w	figs-abstractnouns	ἡ…ὑπομονὴ	1		Voyez comment vous avez traduit **endurance** dans le verset précédent. (Voir : [[rc://en/ta/man/translate/figs-abstractnouns]])

ROM	5	4	gjvh	figs-abstractnouns	δοκιμήν, ἡ δὲ δοκιμὴ	1		Le mot traduit **caractère** se réfère spécifiquement à quelqu'un qui a été approuvé par Dieu parce qu'il a enduré avec succès des épreuves. Si votre langue n'utilise pas de nom abstrait pour l'idée de **caractère**, vous pourriez exprimer la même idée avec une forme verbale. Traduction alternative : "nous fait approuver par Dieu, et quand Dieu nous approuve il" (Voir : [[rc://en/ta/man/translate/figs-abstractnouns]])

ROM	5	4	eh9c	figs-abstractnouns	ἐλπίδα	1		Voyez comment vous avez traduit **espoir** dans [le verset 2](../05/02.md). (Voir : [[rc://en/ta/man/translate/figs-abstractnouns]])

ROM	5	5	u4xh	grammar-connect-logic-result	ἡ δὲ ἐλπὶς οὐ καταισχύνει, ὅτι ἡ ἀγάπη τοῦ Θεοῦ ἐκκέχυται ἐν ταῖς καρδίαις ἡμῶν διὰ Πνεύματος Ἁγίου, τοῦ δοθέντος ἡμῖν	1		Si cela était plus naturel dans votre langue, vous pourriez inverser l'ordre de ces clauses, puisque la deuxième clause donne la raison du résultat que la première décrit. Traduction alternative : "Et parce que l'amour de Dieu a été répandu dans nos cœurs par le Saint-Esprit, qui nous a été donné, cette espérance ne déçoit pas" (Voir : [[rc://en/ta/man/translate/grammar-connect-logic-result]])

