Book	Chapter	Verse	ID	SupportReference	OrigQuote	Occurrence	GLQuote	OccurrenceNote
ROM	2	28	n34i	figs-metonymy	ἡ…περιτομή	1	flesh	Ici, Paul utilise **la circoncision** au sens figuré pour désigner le changement de pensée et d'attitude qui se produit lorsque Dieu sauve une personne. Elle peut aussi être considérée comme une marque intérieure d'appartenance au peuple de Dieu, comme la circoncision était une marque extérieure d'être juif. Ceci était appelé "circoncision du cœur" dans l'Ancien Testament ([Deutéronome 30:6](../../deu/30/06.md) ; [Jérémie 4:4](../../jer/04/04.md)). Ici, **la circoncision** ne fait pas référence au rituel juif. Si cela risque de troubler vos lecteurs, vous pourriez exprimer le sens en clair. Autre traduction possible : "cette circoncision spirituelle" (Voir : [[rc://en/ta/man/translate/figs-metonymy]])

ROM	2	28	s44m	figs-synecdoche	ἐν σαρκὶ	1	flesh	Paul utilise **la chair** au sens figuré pour signifier "le corps entier", qui est fait de **chair**. Si cela risque de troubler vos lecteurs, vous pouvez utiliser une expression équivalente issue de votre culture ou du langage courant. Traduction alternative : "sur le corps" (Voir : [[rc://en/ta/man/translate/figs-synecdoche]])

ROM	2	29	b6ag	figs-explicit	ἐν τῷ κρυπτῷ Ἰουδαῖος	1		Le mot traduit **secrètement** fait référence à quelque chose que les autres personnes ne peuvent pas voir ou qui est caché. Le sens ici est l'opposé de "visiblement" dans le verset précédent. Si cela risque de troubler vos lecteurs, vous pourriez le préciser explicitement. Traduction alternative : "un juif d'une manière intérieure non vue par les autres" (Voir : [[rc://en/ta/man/translate/figs-explicit]])

ROM	2	29	u7b6	figs-metonymy	Ἰουδαῖος	1		Ici, Paul utilise **Juif** au sens figuré de la même manière qu'il l'a fait dans le verset précédent. Voyez comment vous avez traduit ce mot dans le verset précédent. (Voir : [[rc://en/ta/man/translate/figs-metonymy]])

ROM	2	29	d1go	figs-possession	περιτομὴ καρδίας	1		Paul utilise la forme possessive pour décrire une **circoncision** qui s'effectue dans **le cœur**. Si cela n'est pas clair dans votre langue, vous pourriez utiliser une autre expression. Traduction alternative : " la circoncision s'effectue dans le cœur " ou " la circoncision est un changement intérieur " (voir : [[rc://en/ta/man/translate/figs-possession]]).

ROM	2	29	hbiv	figs-idiom	περιτομὴ καρδίας	1		L'expression **circoncision du cœur** est un idiome qui fait référence au changement de pensée et d'attitude qui se produit lorsque Dieu sauve une personne. Elle peut aussi être considérée comme une marque intérieure d'appartenance au peuple de Dieu, comme la circoncision était une marque extérieure d'être juif. Cette expression apparaît pour la première fois dans l'Ancien Testament ([Deutéronome 30:6](../../deu/30/06.md) ; [Jérémie 4:4](../../jer/04/04.md)).Si vos lecteurs ne la comprennent pas, vous pouvez utiliser une expression idiomatique équivalente ou utiliser un langage simple. Voyez comment vous avez traduit "cette circoncision" dans le verset précédent. Traduction alternative : "L'appartenance véritable au peuple de Dieu passe par l'élimination du péché" (Voir : [[rc://en/ta/man/translate/figs-idiom]])

ROM	2	29	n4pp	figs-metonymy	καρδίας	1		Voyez comment vous avez traduit ce mot dans [1:21](../01/21.md). (Voir : [[rc://en/ta/man/translate/figs-metonymy]])

ROM	2	29	ffa3	figs-explicit	ἐν Πνεύματι, οὐ γράμματι	1		Ici, les deux occurrences de **dans** indiquent le moyen par lequel quelque chose s'est produit. Si cela risque de troubler vos lecteurs, vous pourriez le préciser explicitement. Traduction alternative : "par le moyen de l'Esprit, non par le moyen de la lettre" (Voir : [[rc://en/ta/man/translate/figs-explicit]])

ROM	2	29	kjc9	figs-explicit	ἐν Πνεύματι	1		Ici, **l'Esprit** pourrait se référer à : (1) le Saint-Esprit, qui change les pensées et l'attitude d'une personne lorsque Dieu sauve cette personne, comme dans l'UST. (2) l'esprit d'une personne, ce qui nécessiterait d'interpréter **dans** pour faire référence à un lieu. Traduction alternative : "dans l'esprit d'une personne" (Voir : [[rc://en/ta/man/translate/figs-explicit]])

ROM	2	29	gcoq	figs-metonymy	γράμματι	1		Voyez comment vous avez traduit la lettre **>** dans [le verset 27](../02/27.md). (Voir : [[rc://en/ta/man/translate/figs-metonymy]])

ROM	2	29	dlac	writing-pronouns	οὗ ὁ ἔπαινος	1	in the Spirit	Le pronom **dont** fait référence à **celui qui est intérieurement juif**. Si cela peut prêter à confusion pour vos lecteurs, vous pouvez indiquer le sens de manière explicite. Traduction alternative : "cet éloge du Juif intérieur" (Voir : [[rc://en/ta/man/translate/writing-pronouns]])

ROM	2	29	qa6b	figs-possession	οὗ ὁ ἔπαινος	1	in the Spirit	Paul utilise la forme possessive **dont** pour indiquer qui reçoit **la louange**. Si cela n'est pas clair dans votre langue, vous pouvez utiliser une autre expression. Traduction alternative : "sa louange" (Voir : [[rc://en/ta/man/translate/figs-possession]])

ROM	2	29	r4gm	figs-gendernotations	ἐξ ἀνθρώπων	1	in the Spirit	Bien que le terme **hommes** soit masculin, Paul utilise ici le mot dans un sens générique qui inclut les hommes et les femmes. Traduction alternative : "des gens" (Voir : [[rc://en/ta/man/translate/figs-gendernotations]])

ROM	3	intro	y2kb			0		# Romains 3 Notes générales<br><br>## Structure et mise en forme<br><br>3. Toute l'humanité est condamnée à cause du péché (1:18-3:20)<br> * Tous les non-Juifs ont péché (1:18-32)<br> * Tous les Juifs ont péché (2:1-3:8)<br> * Tout le monde a péché (3:9-20)<br>4. La justice est reçue par Jésus-Christ en mettant sa confiance en lui (3:21-5:21)<br> * La justice de Dieu est reçue par la foi (3:21-26)<br> * Personne ne peut se vanter des œuvres (3:27-31)<br><br>Certaines traductions placent chaque ligne de poésie plus à droite que le reste du texte pour en faciliter la lecture. C'est ce que fait l'ULT avec les [versets 4](../03/04.md) et [10-18](../03/10.md) de ce chapitre, qui sont des citations de l'Ancien Testament.<br><br>### Figures de style importantes dans ce chapitre<br><br>### Questions rhétoriques<br><br>Dans les [versets 1-9](../03/01.md) et [27-31](../03/27.md), Paul utilise fréquemment des questions rhétoriques dans ce chapitre afin de répondre aux objections que les Juifs pourraient formuler sur ce qu'il dit. Vous devrez peut-être indiquer que Paul pose ces questions comme s'il était un Juif non chrétien répondant à ses arguments. Lorsque Paul pose les questions rhétoriques, il parle comme s'il était un Juif non chrétien qui argumente contre Paul. Lorsque Paul répond à ces questions, il parle en son nom propre. Il peut être utile à vos lecteurs d'indiquer ce changement de locuteur avec des guillemets ou avec toute autre ponctuation ou convention que votre langue utilise pour indiquer les citations, comme dans l'UST. (Voir : [[rc://en/ta/man/translate/figs-rquestion]] et [[rc://en/ta/man/translate/figs-quotemarks]])

ROM	3	1	v788			0	Connecting Statement:	Dans les [versets 1-9](../03/01.md), Paul utilise une série de questions et de réponses rhétoriques afin de souligner que tant les "Juifs que les Grecs" sont "sous le péché".

ROM	3	1	a1l0	grammar-connect-logic-result	τί οὖν	1		Ici, **puis** indique que ce qui suit est une réponse à ce que Paul a dit dans le chapitre précédent, en particulier ce qu'il a dit dans [2:28-29](../02/28.md). Si cela peut aider vos lecteurs, vous pourriez l'indiquer explicitement. Traduction alternative : "Si ces choses sont vraies, alors qu'est-ce qui l'est ?" (Voir : [[rc://en/ta/man/translate/grammar-connect-logic-result]])

ROM	3	1	dawv	figs-rquestion	τί οὖν τὸ περισσὸν τοῦ Ἰουδαίου, ἢ τίς ἡ ὠφέλια τῆς περιτομῆς?	1		Ce verset contient deux questions rhétoriques reliées par **ou**. Paul ne demande pas d'informations, mais utilise ces deux questions ici pour exprimer les objections qu'un Juif pourrait avoir à ce que Paul a dit dans le chapitre précédent, en particulier ce qu'il a dit dans [2:28-29](../02/28.md). Si vous n'utilisez pas une question rhétorique à cette fin dans votre langue, vous pouvez traduire ses mots comme une déclaration ou une exclamation et communiquer l'accent d'une autre manière. Traduction alternative : "Alors le Juif n'a certainement aucun avantage, et la circoncision n'a certainement aucun avantage !". (Voir : [[rc://en/ta/man/translate/figs-rquestion]])

ROM	3	1	b7ls	figs-quotemarks	τί οὖν τὸ περισσὸν τοῦ Ἰουδαίου, ἢ τίς ἡ ὠφέλια τῆς περιτομῆς	1		Dans ce verset, Paul parle comme s'il s'agissait d'un Juif non-chrétien qui argumente contre Paul. Il peut être utile à vos lecteurs de l'indiquer avec des guillemets ou avec toute autre ponctuation ou convention que votre langue utilise pour indiquer les citations, comme dans l'UST. (Voir : [[rc://en/ta/man/translate/figs-quotemarks]])

ROM	3	1	bjfo	figs-abstractnouns	τί οὖν τὸ περισσὸν τοῦ Ἰουδαίου, ἢ τίς ἡ ὠφέλια τῆς περιτομῆς	1		Si votre langue n'utilise pas de noms abstraits pour les idées de **avantage** ou **bénéfice**, vous pouvez exprimer la même idée d'une autre manière. Traduction alternative : "Comment donc être juif est-il avantageux, ou comment être circoncis est-il bénéfique ?" (Voir : [[rc://en/ta/man/translate/figs-abstractnouns]]).

ROM	3	1	h4h3	figs-possession	τοῦ Ἰουδαίου	1		Paul utilise la forme possessive **du Juif** pour décrire celui pour qui il y a **l'avantage**. Si cela n'est pas clair dans votre langue, vous pourriez utiliser une autre expression. Traduction alternative : "pour le Juif" (Voir : [[rc://en/ta/man/translate/figs-possession]])

ROM	3	1	l79f	figs-possession	τῆς περιτομῆς	1		Paul utilise la forme possessive **de la circoncision** pour décrire d'où **vient le bénéfice**. Si cela n'est pas clair dans votre langue, vous pourriez utiliser une autre expression. Traduction alternative : " qui vient de la circoncision " ou " d'être circoncis " (Voir : [[rc://en/ta/man/translate/figs-possession]]).

ROM	3	2	eq3o	figs-explicit	πολὺ κατὰ πάντα τρόπον	1	It is great in every way	Dans ce verset, Paul répond aux questions rhétoriques du verset précédent. Si cela peut aider vos lecteurs, vous pouvez le dire explicitement. Traduction alternative : "Je répondrais en disant : 'formidable à tous points de vue !'". (Voir : [[rc://en/ta/man/translate/figs-explicit]])

ROM	3	2	rri9	figs-ellipsis	πολὺ κατὰ πάντα τρόπον	1	It is great in every way	Paul laisse de côté certains des mots dont une phrase aurait besoin dans de nombreuses langues pour être complète. Si cela peut être mal compris dans votre langue, vous pouvez utiliser ces mots du verset précédent. Traduction alternative : "L'avantage du Juif et le bénéfice de la circoncision sont grands à tous égards" (Voir : [[rc://en/ta/man/translate/figs-ellipsis]])

ROM	3	2	kzlh	figs-hyperbole	πολὺ κατὰ πάντα τρόπον	1		**Grand à tous égards** est une exagération que Paul utilise pour souligner la valeur d'être juif et d'être circoncis. Paul ne veut pas dire que tout ce qui concerne le fait d'être juif et d'être circoncis est bénéfique. Si vos lecteurs comprenaient mal ainsi, vous pourriez utiliser une expression équivalente de votre langue qui montre l'enthousiasme. Traduction alternative : "Grand à bien des égards" (Voir : [[rc://en/ta/man/translate/figs-hyperbole]])

ROM	3	2	f2fa	figs-explicit	πρῶτον μὲν…ὅτι	1		Ici, **en effet premier, que** pourrait indiquer que : (1) ce qui suit est la première raison d'une liste de plusieurs raisons pour lesquelles être juif est bénéfique, auquel cas Paul ne poursuit pas la liste dans ce chapitre. Traduction alternative : "le premier de plusieurs avantages est en effet cela" ou "un avantage est en effet cela" (2) ce qui suit est la raison la plus importante pour laquelle être juif est bénéfique. Autre traduction : "le principal avantage est en effet cela" ou "la chose la plus importante est en effet cela" (Voir : [[rc://en/ta/man/translate/figs-explicit]])

ROM	3	2	mrej	figs-activepassive	ἐπιστεύθησαν τὰ λόγια τοῦ Θεοῦ	1		Si votre langue n'utilise pas la forme passive de cette manière, vous pourriez exprimer l'idée à la forme active ou d'une autre manière qui est naturelle dans votre langue. Si vous devez préciser qui a fait l'action, Paul implique que "Dieu" l'a fait. Traduction alternative : "Dieu leur a confié ses paroles" ou "Dieu leur a confié les paroles de Dieu" (voir : [[rc://en/ta/man/translate/figs-activepassive]]).

ROM	3	2	jkgk	figs-metonymy	τὰ λόγια τοῦ Θεοῦ	1		Ici, **les paroles de Dieu** pourraient se référer à : (1) l'ensemble de l'Ancien Testament. Traduction alternative : "avec ce que Dieu a dit dans les Écritures" (2) le discours direct de Dieu dans l'Ancien Testament. Traduction alternative : "avec les messages que Dieu leur a annoncés dans les Ecritures" (Voir : [[rc://en/ta/man/translate/figs-metonymy]])

ROM	3	2	qide	figs-possession	τὰ λόγια τοῦ Θεοῦ	1		Ici, la forme possessive **de Dieu** pourrait se référer à : (1) **les dictons** qui venaient de **Dieu**. Traduction alternative : "avec les dires de Dieu" (2) **les dires** qui concernent **Dieu**. Autre traduction : "with the sayings about God" (Voir : [[rc://en/ta/man/translate/figs-possession]])

ROM	3	3	d9k3	grammar-connect-logic-result	γάρ	1		**Car** ici indique que ce qui suit est une réponse à ce que Paul a dit dans le verset précédent. Si cela peut aider vos lecteurs, vous pourriez l'indiquer explicitement. Traduction alternative : "Si ces choses sont vraies, alors" (Voir : [[rc://en/ta/man/translate/grammar-connect-logic-result]])

ROM	3	3	mclv	figs-rquestion	τί…εἰ ἠπίστησάν τινες? μὴ ἡ ἀπιστία αὐτῶν, τὴν πίστιν τοῦ Θεοῦ καταργήσει?	1		Dans ce verset, Paul ne demande pas d'informations, mais utilise ces deux questions pour exprimer les objections qu'un Juif pourrait avoir à ce que Paul a dit dans le verset précédent. Si vous n'utilisiez pas une question rhétorique à cette fin dans votre langue, vous pourriez traduire ses mots comme une déclaration ou une exclamation et communiquer l'accent d'une autre manière. Traduction alternative : "Mais certains d'entre eux ont été infidèles ! Leur infidélité ne peut certainement pas annuler la fidélité de Dieu !" (Voir : [[rc://en/ta/man/translate/figs-rquestion]])

ROM	3	3	fd0w	figs-quotemarks	τί γάρ εἰ ἠπίστησάν τινες? μὴ ἡ ἀπιστία αὐτῶν, τὴν πίστιν τοῦ Θεοῦ καταργήσει?	1		Dans ce verset, Paul parle comme s'il s'agissait d'un Juif non-chrétien qui argumente contre Paul. Il peut être utile à vos lecteurs de l'indiquer avec des guillemets ou avec toute autre ponctuation ou convention que votre langue utilise pour indiquer les citations, comme dans l'UST. (Voir : [[rc://en/ta/man/translate/figs-quotemarks]])

ROM	3	3	i36p	writing-pronouns	τινες	1		Le pronom **some** fait référence à certaines personnes juives. Si cela risque de troubler vos lecteurs, vous pouvez indiquer le sens de manière explicite. Traduction alternative : "some Jewish people" (Voir : [[rc://en/ta/man/translate/writing-pronouns]])

ROM	3	3	pkae	figs-abstractnouns	μὴ ἡ ἀπιστία αὐτῶν, τὴν πίστιν τοῦ Θεοῦ καταργήσει	1		Si votre langue n'utilise pas de noms abstraits pour les idées de **infidélité** ou **fidélité**, vous pourriez exprimer les mêmes idées d'une autre manière. Traduction alternative : "Le fait qu'ils soient infidèles n'annulera pas les actes fidèles de Dieu, n'est-ce pas ?" (Voir : [[rc://en/ta/man/translate/figs-abstractnouns]]).

ROM	3	3	moq7	figs-possession	τὴν πίστιν τοῦ Θεοῦ	1		Paul utilise la forme possessive pour décrire **la fidélité** qui caractérise **Dieu**. Si cela risque de troubler vos lecteurs, vous pouvez utiliser une autre expression. Traduction alternative : "la fidélité qui caractérise Dieu" (Voir : [[rc://en/ta/man/translate/figs-possession]])

ROM	3	4	djn7	figs-explicit	μὴ γένοιτο	1	May it never be	Dans ce verset, Paul répond aux questions rhétoriques qu'il a écrites dans le verset précédent. Si cela peut aider vos lecteurs, vous pourriez le dire explicitement. Traduction alternative : " Je répondrais en disant : " Que cela ne soit jamais ! ". (Voir : [[rc://en/ta/man/translate/figs-explicit]])

ROM	3	4	z465	figs-exclamations	μὴ γένοιτο	1	May it never be	**Que cela ne soit jamais** est une phrase exclamative qui communique une forte interdiction. Utilisez une exclamation qui est naturelle dans votre langue pour communiquer une forte interdiction. Autre traduction possible : "Absolument pas" ou "Certainement pas" (Voir : [[rc://en/ta/man/translate/figs-exclamations]])

ROM	3	4	kz4j	grammar-connect-logic-contrast	δὲ	1	Instead, let be found	**Au lieu de cela,** ici indique que ce qui suit est un contraste avec l'idée du verset précédent selon laquelle les Juifs infidèles pourraient "annuler la fidélité de Dieu." Utilisez un moyen naturel dans votre langue pour introduire un contraste. Traduction alternative : "Mais" ou "Cependant" (Voir : [[rc://en/ta/man/translate/grammar-connect-logic-contrast]])

ROM	3	4	ld9h	figs-imperative	γινέσθω…ὁ Θεὸς ἀληθής	1	let God be found to be true	Ici, **que Dieu soit vrai** est une phrase impérative, mais ce n'est pas un commandement. Au lieu de cela, Paul s'exclame que les gens doivent considérer que Dieu est toujours véridique, indépendamment de ce que les gens pensent. Utilisez une forme dans votre langue qui serait utilisée dans ce type de situation. Traduction alternative : "que les gens sachent toujours que Dieu est vrai" ou "que les gens déclarent toujours que Dieu est vrai" (Voir : [[rc://en/ta/man/translate/figs-imperative]])

ROM	3	4	nud9	figs-abstractnouns	πᾶς…ἄνθρωπος ψεύστης	1	even though every man is a liar	Si votre langue n'utilise pas de nom abstrait pour l'idée de **menteur**, vous pouvez exprimer la même idée d'une autre manière. Traduction alternative : "tout homme ment" (Voir : [[rc://en/ta/man/translate/figs-abstractnouns]])

ROM	3	4	fesk	figs-ellipsis	πᾶς…ἄνθρωπος ψεύστης	1		Paul laisse de côté certains mots dont une phrase aurait besoin dans de nombreuses langues pour être complète. Si vos lecteurs risquent de mal comprendre, vous pouvez fournir ces mots de la clause précédente. Traduction alternative : "que tout homme soit un menteur" (Voir : [[rc://en/ta/man/translate/figs-ellipsis]])

ROM	3	4	hfdf	figs-gendernotations	πᾶς…ἄνθρωπος	1		Bien que le terme **homme** soit masculin, Paul utilise ici le mot dans un sens générique qui inclut les hommes et les femmes. Traduction alternative : "toute personne" (Voir : [[rc://en/ta/man/translate/figs-gendernotations]])

ROM	3	4	te39	writing-quotations	καθὼς γέγραπται	1	As it has been written	Voyez comment vous avez traduit cette phrase dans [1:17](../01/17.md). (Voir : [[rc://en/ta/man/translate/writing-quotations]])

ROM	3	4	b8gv	figs-activepassive	καθὼς γέγραπται	1	As it has been written	Si votre langue n'utilise pas la forme passive de cette manière, vous pouvez l'énoncer à la forme active ou d'une autre manière qui est naturelle dans votre langue. Si vous devez indiquer qui a fait l'action, la citation a été écrite par David, un roi d'Israël. Traduction alternative : "comme le roi David l'a écrit" (Voir : [[rc://en/ta/man/translate/figs-activepassive]])

ROM	3	4	f0oq	figs-quotemarks	ὅπως ἂν δικαιωθῇς ἐν τοῖς λόγοις σου, καὶ νικήσεις ἐν τῷ κρίνεσθαί σε	1	As it has been written	Cette phrase est une citation de [Psaume 51:4](../../psa/51/04.md). Il peut être utile à vos lecteurs de l'indiquer en mettant tout ce matériel entre guillemets ou avec toute autre ponctuation ou convention utilisée dans votre langue pour indiquer une citation. (Voir : [[rc://en/ta/man/translate/figs-quotemarks]])

ROM	3	4	xli0	grammar-connect-logic-result	ὅπως	1		**Donc ce** indique que ce qui suit est le résultat de ce que David avait écrit précédemment dans [Psaume 51:4](../../psa/51/04.md), qui concerne la façon dont David avait péché. Paul suppose que ses lecteurs sont familiers avec la première partie de ce verset. Si cela risque d'embrouiller vos lecteurs, vous pouvez l'indiquer explicitement. Traduction alternative : "J'ai péché de telle sorte que" ou "A cause de mon péché" (Voir : [[rc://en/ta/man/translate/grammar-connect-logic-result]])

ROM	3	4	h0ne	figs-you	ὅπως ἂν δικαιωθῇς ἐν τοῖς λόγοις σου, καὶ νικήσεις ἐν τῷ κρίνεσθαί σε	1		Dans cette phrase, **vous** et **votre** se réfèrent à Dieu et sont au singulier. Si cela peut prêter à confusion pour vos lecteurs, vous pourriez l'indiquer explicitement, comme dans l'UST. (Voir : [[rc://en/ta/man/translate/figs-you]])

ROM	3	4	lnnr	figs-activepassive	δικαιωθῇς…ἐν τῷ κρίνεσθαί σε	1		Si votre langue n'utilise pas la forme passive de cette manière, vous pouvez l'énoncer à la forme active ou d'une autre manière qui soit naturelle dans votre langue. Traduction alternative : "les gens reconnaîtraient à quel point vous êtes vertueux ... lorsque les gens essaient de vous juger" ou "vous prouveriez que vous êtes vertueux ... lorsque les autres essaient de vous juger" (voir : [[rc://en/ta/man/translate/figs-activepassive]]).

ROM	3	4	tj8g	figs-metonymy	ἐν τοῖς λόγοις σου	1		Paul rapporte que David a utilisé **des mots** au sens figuré pour décrire les choses que Dieu a dites en utilisant des mots. Si cela risque d'embrouiller vos lecteurs, vous pourriez exprimer le sens de façon claire. Traduction alternative : "dans ce que vous dites" (Voir : [[rc://en/ta/man/translate/figs-metonymy]])

ROM	3	5	gw3a	grammar-connect-words-phrases	εἰ δὲ	1		**Mais** ici indique que ce qui suit est une réponse à ce que Paul a dit dans le verset précédent. Dans ce verset, Paul parle comme s'il était un Juif non croyant et conteste la déclaration que Paul a faite dans le verset précédent. Si cela peut aider vos lecteurs, vous pourriez le dire explicitement. Autre traduction possible : "Si vraiment cela est vrai" ou "Maintenant si" (Voir : [[rc://en/ta/man/translate/grammar-connect-words-phrases]])

ROM	3	5	putf	figs-quotemarks	εἰ δὲ ἡ ἀδικία ἡμῶν, Θεοῦ δικαιοσύνην συνίστησιν, τί ἐροῦμεν? μὴ ἄδικος ὁ Θεὸς, ὁ ἐπιφέρων τὴν ὀργήν?	1		Dans ces phrases, Paul parle comme s'il s'agissait d'un Juif non-chrétien qui argumente contre Paul. Il peut être utile à vos lecteurs de l'indiquer avec des guillemets ou avec toute autre ponctuation ou convention que votre langue utilise pour indiquer les citations, comme dans l'UST. (Voir : [[rc://en/ta/man/translate/figs-quotemarks]])

ROM	3	5	hjyp	grammar-connect-condition-hypothetical	εἰ…ἡ ἀδικία ἡμῶν, Θεοῦ δικαιοσύνην συνίστησιν, τί ἐροῦμεν?	1		Paul se sert d'une situation hypothétique pour développer l'argument que ferait un Juif incroyant. Traduction alternative : " supposez que notre iniquité recommande la justice de Dieu. Que dirons-nous alors ?" (Voir : [[rc://en/ta/man/translate/grammar-connect-condition-hypothetical]])

ROM	3	5	y6vv	figs-exclusive	ἡμῶν…ἐροῦμεν	1		Ici, **notre** et **nous** sont utilisés exclusivement pour parler de Paul et des autres Juifs. Votre langue peut vous demander de marquer ces formes. Traduction alternative : "Juif ... nous, juifs, dirons" (Voir : [[rc://en/ta/man/translate/figs-exclusive]])

ROM	3	5	y0r5	figs-abstractnouns	ἡ ἀδικία ἡμῶν, Θεοῦ δικαιοσύνην	1		Si votre langue n'utilise pas de noms abstraits pour ces idées, vous pourriez exprimer les idées derrière **injustice** et **droiture** d'une autre manière. Traduction alternative : "Comme nous sommes injustes... comme Dieu est juste" (Voir : [[rc://en/ta/man/translate/figs-abstractnouns]])

ROM	3	5	ho67	figs-rquestion	μὴ ἄδικος ὁ Θεὸς, ὁ ἐπιφέρων τὴν ὀργήν?	1		Dans cette phrase, Paul ne demande pas d'informations, mais il utilise cette question pour exprimer une objection qu'un Juif pourrait faire à ce que Paul a dit dans le verset précédent. Cette phrase est également la réponse à la question hypothétique qui la précède. Si vous n'utilisiez pas une question rhétorique à cette fin dans votre langue, vous pourriez traduire ses mots comme une déclaration ou une exclamation et communiquer l'accent d'une autre manière. Traduction alternative : "Dieu ne peut certainement pas être injuste pour imposer sa colère !". (Voir : [[rc://en/ta/man/translate/figs-rquestion]])

