Book	Chapter	Verse	ID	SupportReference	OrigQuote	Occurrence	GLQuote	OccurrenceNote
JAS	3	18	htr1	figs-abstractnouns	καρπὸς…δικαιοσύνης ἐν εἰρήνῃ σπείρεται, τοῖς ποιοῦσιν εἰρήνην	1	the fruit of righteousness is sown in peace by those who make peace	Si vos lecteurs comprenaient mal les noms abstraits **droiture** et **paix**, vous pourriez exprimer les idées qui les sous-tendent avec des expressions équivalentes. Traduction alternative : "ceux qui travaillent pacifiquement pour aider les gens à vivre ensemble pacifiquement aident ces gens à vivre de manière juste" (Voir : [[rc://fr/ta/man/translate/figs-abstractnouns]]).

JAS	3	18	j238	figs-activepassive	καρπὸς…δικαιοσύνης ἐν εἰρήνῃ σπείρεται, τοῖς ποιοῦσιν εἰρήνην	1	the fruit of righteousness is sown in peace by those who make peace	Si vous décidez de conserver la métaphore des semailles, vous pourriez l'exprimer avec une forme verbale active, si cela peut aider vos lecteurs. Traduction alternative : "ceux qui font la paix sèment le fruit de la justice dans la paix" (Voir : [[rc://fr/ta/man/translate/figs-activepassive]])

JAS	4	intro	r6vv			0		# Jacques 4 Notes générales<br><br>## Structure et mise en forme<br><br>1. Les désirs mondains et le péché et le conflit qu'ils causent (4:1-12)<br>2. Un avertissement contre la vantardise du lendemain (4:13-17)<br><br>### Les figures de style importantes dans ce chapitre<br><br>### L'adultère<br><br>Les écrivains de la Bible parlent souvent de l'adultère comme une métaphore pour les personnes qui disent aimer Dieu mais font des choses que Dieu déteste. Jacques utilise la même métaphore dans [4:4](../04/04.md). (Voir : [[rc://fr/ta/man/translate/figs-metaphor]] et [[rc://fr/tw/dict/bible/kt/godly]])

JAS	4	1	j239		πόθεν πόλεμοι καὶ πόθεν μάχαι ἐν ὑμῖν	1	Whence are wars and whence are battles among you	Le mot traduit **> whence <** signifie "d'où". Votre langue peut avoir un mot similaire que vous pouvez utiliser dans votre traduction. Sinon, vous pouvez exprimer le même sens d'une manière qui serait naturelle dans votre langue. Traduction alternative : "D'où viennent les guerres et les batailles entre vous".

JAS	4	1	j240	figs-metaphor	πόθεν πόλεμοι καὶ πόθεν μάχαι ἐν ὑμῖν	1	Whence are wars and whence are battles among you	Jacques utilise les termes **guerres** et **batailles** au sens figuré. Traduction alternative : " D'où viennent les conflits et les disputes que vous avez " (voir : [[rc://fr/ta/man/translate/figs-metaphor]]).

JAS	4	1	pqx2	figs-rquestion	πόθεν πόλεμοι καὶ πόθεν μάχαι ἐν ὑμῖν?	1	Whence are wars and whence are battles among you?	Jacques utilise la forme de la question comme un outil d'enseignement. Si vos lecteurs comprennent mal cette question, vous pouvez traduire ses mots comme une déclaration. Traduction alternative : "Je vais vous dire d'où viennent les conflits et les disputes que vous avez." (Voir : [[rc://fr/ta/man/translate/figs-rquestion]])

JAS	4	1	ub82	figs-doublet	πόθεν πόλεμοι καὶ πόθεν μάχαι ἐν ὑμῖν?	1	Whence are wars and whence are battles among you?	Les mots **guerres** et **batailles** signifient des choses similaires. Jacques les utilise ensemble pour mettre l'accent. Si vos lecteurs comprenaient mal ce lien, vous pourriez les traduire par une seule expression. Traduction alternative (comme une déclaration) : "Je vais vous dire d'où viennent les conflits continuels que vous avez." (Voir : [[rc://fr/ta/man/translate/figs-doublet]])

JAS	4	1	j241	figs-rquestion	οὐκ ἐντεῦθεν ἐκ τῶν ἡδονῶν ὑμῶν, τῶν στρατευομένων ἐν τοῖς μέλεσιν ὑμῶν?	1	Are they not hence, from your lusts, which fight in your members?	Jacques utilise la forme de la question comme un outil d'enseignement. Si vos lecteurs comprennent mal cette question, vous pouvez traduire ses mots comme une déclaration. Traduction alternative : "Voici d'où elles viennent : de vos convoitises, qui combattent dans vos membres". (Voir : [[rc://fr/ta/man/translate/figs-rquestion]])

JAS	4	1	j242		οὐκ ἐντεῦθεν	1	Are they not hence	Le mot traduit **> d'où <** signifie "d'ici". Votre langue peut avoir un mot similaire que vous pouvez utiliser dans votre traduction. Sinon, vous pouvez exprimer le même sens d'une manière qui serait naturelle dans votre langue. Traduction alternative : "Ne viennent-ils pas d'ici"

JAS	4	1	v5kg	figs-metaphor	τῶν ἡδονῶν ὑμῶν, τῶν στρατευομένων ἐν τοῖς μέλεσιν ὑμῶν	1	your lusts, which fight in your members	Comme dans [3:6](../03/06.md), **membres** signifie "parties du corps". Cela pourrait signifier : (1) l'expression **dans vos membres** indique l'emplacement des **convoitises** que Jacques décrit. Il pourrait dire que les luttes extérieures entre les membres de la communauté ont leur origine dans les convoitises intérieures qui conduisent les gens à se battre pour ce qu'ils veulent, comme il le décrit dans le verset suivant. Dans ce cas, il utilise les parties du corps au sens figuré pour représenter les pensées et les émotions d'une personne. Traduction alternative : " les convoitises en vous qui combattent " (2) le mot traduit **dans** signifie " parmi ". Le sens serait alors que ces **convoitises** luttent contre une partie de la personne après l'autre, cherchant à prendre le contrôle de toute la personne. Puisque les **convoitises** prendraient en fait le contrôle des aspects non physiques d'une personne, tels que sa volonté et ses valeurs, Jacques utiliserait une fois de plus les parties physiques du corps au sens figuré pour exprimer son sens. Traduction alternative : "(3) Jacques parle au sens figuré de la communauté des croyants comme s'il s'agissait d'un corps et des croyants individuels comme s'ils étaient des parties de ce corps. Traduction alternative : "vos convoitises, qui luttent contre les autres croyants" (Voir : [[rc://fr/ta/man/translate/figs-metaphor]])

JAS	4	1	vpe2	figs-personification	τῶν ἡδονῶν ὑμῶν, τῶν στρατευομένων ἐν τοῖς μέλεσιν ὑμῶν	1	your lusts, which fight in your members	Dans tous les cas que la note précédente aborde, Jacques parlerait au sens figuré des **convoitises** comme s'il s'agissait d'êtres vivants qui pourraient **se battre.** Traduction alternative : " les convoitises qui sont en vous et qui vous poussent à vous battre pour obtenir ce que vous voulez " de " vos convoitises qui vous poussent à valoriser et à choisir certaines choses afin de les gratifier " ou " vos convoitises qui vous poussent à vous battre contre d'autres croyants " (Voir : [[rc://fr/ta/man/translate/figs-personification]]).

JAS	4	2	j243	grammar-connect-logic-contrast	ἐπιθυμεῖτε καὶ οὐκ ἔχετε; φονεύετε καὶ ζηλοῦτε, καὶ οὐ δύνασθε ἐπιτυχεῖν	1	You covet, and you do not have. You kill and envy, and you are not able to obtain	Dans ces deux phrases, Jacques utilise les mots traduits **et** pour introduire un contraste entre la première et la deuxième clause. Traduction alternative : " Vous convoitez, mais vous ne possédez pas. Vous tuez et vous enviez, mais vous ne pouvez pas obtenir" (Voir : [[rc://fr/ta/man/translate/grammar-connect-logic-contrast]])

JAS	4	2	j244		ἐπιθυμεῖτε καὶ οὐκ ἔχετε; φονεύετε καὶ ζηλοῦτε, καὶ οὐ δύνασθε ἐπιτυχεῖν	1	You covet, and you do not have. You kill and envy, and you are not able to obtain	Votre langue peut vous demander de préciser les objets de **> have <** et **> obtain <**> . Traduction alternative : "Vous convoitez, mais vous n'avez pas ce que vous convoitez. Vous tuez et enviez, mais vous ne pouvez pas obtenir les choses que vous enviez".

JAS	4	2	j245	figs-parallelism	ἐπιθυμεῖτε καὶ οὐκ ἔχετε; φονεύετε καὶ ζηλοῦτε, καὶ οὐ δύνασθε ἐπιτυχεῖν	1	You covet, and you do not have. You kill and envy, and you are not able to obtain	Ces deux phrases signifient des choses similaires. Jacques les utilise ensemble pour les mettre en valeur. Si vos lecteurs risquent de mal comprendre ce lien, vous pouvez les combiner. Traduction alternative : "Vous voulez désespérément des choses que d'autres personnes ont, mais vous ne pouvez pas les obtenir" (Voir : [[rc://fr/ta/man/translate/figs-parallelism]])

JAS	4	2	khh9	figs-metaphor	φονεύετε καὶ ζηλοῦτε	1	You kill and envy	Jacques ne veut probablement pas dire le mot **tuer** littéralement. Cela pourrait plutôt signifier : (1) Jacques utilise ce mot dans un sens figuré et spirituel pour signifier "haïr". Cet usage refléterait l'enseignement de Jésus et des apôtres. Jésus a dit que le sens du commandement "ne pas tuer" s'appliquait également au fait d'être en colère contre les autres et de les insulter ([Matthieu 5:21-22](../mat/05/21.md)). L'apôtre Jean a écrit que "quiconque hait son frère est un meurtrier" ([1 Jean 3:15](../1jn/03/15.md)). Traduction alternative : "Vous haïssez et vous enviez" (2) Jacques décrit quelqu'un qui désire tellement quelque chose qu'il serait presque prêt à tuer pour l'obtenir. Traduction alternative : "Vous enviez presque jusqu'au meurtre" (Voir : [[rc://fr/ta/man/translate/figs-metaphor]])

JAS	4	2	j246	figs-hendiadys	φονεύετε καὶ ζηλοῦτε	1	You kill and envy	Jacques exprime une seule idée en utilisant deux mots reliés par **et.** Le mot **tuer** décrit comment ses lecteurs **envient** ce que les autres ont. Traduction alternative : "you envy hatefully" de "you envy murderously" (Voir : [[rc://fr/ta/man/translate/figs-hendiadys]])

JAS	4	2	j247	figs-metaphor	μάχεσθε καὶ πολεμεῖτε	1	You battle and war	Comme dans [4:1](../04/01.md), Jacques utilise les termes **bataille** et **guerre** au sens figuré. Traduction alternative : " Vous vous engagez dans des disputes et des conflits " (voir : [[rc://fr/ta/man/translate/figs-metaphor]]).

JAS	4	2	v9m8	figs-doublet	μάχεσθε καὶ πολεμεῖτε	1	You battle and war	Les mots **bataille** et **guerre** signifient des choses similaires. Jacques les utilise ensemble pour les mettre en valeur. Si vos lecteurs comprenaient mal ce lien, vous pourriez les traduire par une seule expression. Traduction alternative : " Vous avez des conflits continuels " (voir : [[rc://fr/ta/man/translate/figs-doublet]]).

JAS	4	2	j248	figs-explicit	οὐκ ἔχετε, διὰ τὸ μὴ αἰτεῖσθαι ὑμᾶς	1	You do not have because you do not ask	Si cela peut être utile à vos lecteurs, vous pourriez exprimer plus complètement ce que cela signifie. Traduction alternative : "Vous n'obtenez pas ce que vous voulez parce que vous ne le demandez pas à Dieu" (Voir : [[rc://fr/ta/man/translate/figs-explicit]])

JAS	4	3	j249	grammar-connect-logic-contrast	αἰτεῖτε καὶ οὐ λαμβάνετε	1	You ask and you do not receive	Jacques utilise le mot traduit **et** pour introduire un contraste entre ces deux clauses. Traduction alternative : "Vous demandez mais vous ne recevez pas" (Voir : [[rc://fr/ta/man/translate/grammar-connect-logic-contrast]])

JAS	4	3	nk57		κακῶς αἰτεῖσθε	1	you ask badly	Jacques ne veut pas dire que ses lecteurs demandent les choses de la mauvaise manière. Il veut dire qu'ils demandent pour la mauvaise raison. Traduction alternative : "vous demandez pour la mauvaise raison"

JAS	4	3	j250	figs-metaphor	ἵνα ἐν ταῖς ἡδοναῖς ὑμῶν δαπανήσητε	1	so that you may spend on your lusts	Jacques dit figurativement que ses lecteurs dépenseraient **>** ce qu'ils ont acquis pour leurs convoitises. Traduction alternative : " afin que vous puissiez assouvir vos désirs pécheurs " (voir : [[rc://fr/ta/man/translate/figs-metaphor]]).

JAS	4	4	j251		μοιχαλίδες	1	Adulteresses	Jacques s'adresse à ses lecteurs au vocatif. Si votre langue possède un vocatif, il serait approprié de l'utiliser ici. Sinon, vous pourriez exprimer le sens d'une autre manière qui serait naturelle dans votre langue. Traduction alternative : "Vous, adultères"

JAS	4	4	efi8	figs-metaphor	μοιχαλίδες	1	Adulteresses	Jacques décrit figurativement ses lectrices comme des femmes mariées qui ont des relations sexuelles avec des hommes qui ne sont pas leurs maris. Cette métaphore est utilisée à de nombreux endroits dans la Bible pour représenter l'infidélité à Dieu. Traduction alternative : "Vous n'êtes pas fidèles à Dieu" (Voir : [[rc://fr/ta/man/translate/figs-metaphor]])

JAS	4	4	wu5v	figs-rquestion	οὐκ οἴδατε ὅτι ἡ φιλία τοῦ κόσμου, ἔχθρα τοῦ Θεοῦ ἐστιν?	1	Do you not know that friendship with the world is enmity with God?	Jacques utilise la forme interrogative pour mettre l'accent et comme outil d'enseignement. Si vos lecteurs comprenaient mal cette question, vous pourriez traduire ses paroles comme une déclaration ou une exclamation. Traduction alternative : " Certes, vous savez que l'amitié avec le monde est inimitié avec Dieu ! ". (Voir : [[rc://fr/ta/man/translate/figs-rquestion]])

JAS	4	4	j252	figs-abstractnouns	ἡ φιλία τοῦ κόσμου, ἔχθρα τοῦ Θεοῦ ἐστιν	1	friendship with the world is enmity with God	Si vos lecteurs comprenaient mal les noms abstraits **amitié** et **inimitié**, vous pourriez exprimer les idées qui les sous-tendent avec les noms concrets "ami" et "ennemi". Traduction alternative : "si tu es un ami du monde, tu es un ennemi de Dieu" (Voir : [[rc://fr/ta/man/translate/figs-abstractnouns]])

JAS	4	4	b5ly	figs-metonymy	ἡ φιλία τοῦ κόσμου	1	friendship with the world	Comme dans [1:27](../01/27.md), Jacques utilise le terme **monde** au sens figuré pour désigner le système de valeurs partagé par les personnes qui n'honorent pas Dieu. Traduction alternative : " amitié avec un système de valeurs impies " (Voir : [[rc://fr/ta/man/translate/figs-metonymy]]).

JAS	4	4	br36	figs-personification	ἡ φιλία τοῦ κόσμου	1	friendship with the world	Jacques parle au sens figuré de ce système de valeurs impies comme s'il s'agissait d'une personne avec laquelle on pourrait être ami. Autre traduction : "vivre selon un système de valeurs impies" (Voir : [[rc://fr/ta/man/translate/figs-personification]])

JAS	4	4	jf1g	figs-metaphor	ἔχθρα τοῦ Θεοῦ ἐστιν	1	is enmity with God	Jacques ne considère probablement pas que ses lecteurs sont littéralement devenus des ennemis jurés de Dieu. Il utilise le terme **inimitié** au sens figuré pour décrire à quel point le système de valeurs du monde est opposé à la manière dont Dieu veut que les gens vivent. Traduction alternative : "est contraire à ce que Dieu veut" (Voir : [[rc://fr/ta/man/translate/figs-metaphor]])

JAS	4	4	j253	figs-metonymy	φίλος εἶναι τοῦ κόσμου	1	to be a friend of the world	Voyez comment vous avez traduit le terme **monde** plus tôt dans ce verset. Traduction alternative : "être l'ami d'un système de valeurs impies" (Voir : [[rc://fr/ta/man/translate/figs-metonymy]]).

JAS	4	4	j254	figs-personification	φίλος εἶναι τοῦ κόσμου	1	to be a friend of the world	Jacques parle encore au sens figuré du système de valeurs impies comme s'il s'agissait d'une personne avec laquelle on pourrait être ami. Traduction alternative : "vivre selon un système de valeurs impies" (Voir : [[rc://fr/ta/man/translate/figs-personification]])

JAS	4	4	j255	figs-activepassive	καθίσταται	1	is made	Si vos lecteurs comprennent mal ce verbe passif, vous pouvez l'exprimer avec une forme active. Traduction alternative : "se fait" (Voir : [[rc://fr/ta/man/translate/figs-activepassive]])

JAS	4	4	j256	figs-metaphor	ἐχθρὸς τοῦ Θεοῦ	1	an enemy of God	Voyez comment vous avez traduit l'expression similaire plus tôt dans ce verset. Autre traduction : "quelqu'un qui vit d'une manière contraire à ce que Dieu veut" (Voir : [[rc://fr/ta/man/translate/figs-metaphor]])

JAS	4	5	i2y4	figs-rquestion	ἢ δοκεῖτε ὅτι κενῶς ἡ Γραφὴ λέγει	1	Or do you think that the Scripture says vainly	Jacques utilise la forme de la question comme un outil d'enseignement. Si vos lecteurs comprenaient mal cette question, vous pourriez traduire ses paroles comme une déclaration. (Dans ce contexte, le terme **vainement** signifie "sans raison valable", et non "de manière vaniteuse"). Traduction alternative : " Il y a une bonne raison pour laquelle l'Écriture dit " (Voir : [[rc://fr/ta/man/translate/figs-rquestion]]).

JAS	4	5	j257		ἡ Γραφὴ λέγει	1	the Scripture says	Jacques décrit l'enseignement général de la Bible, sans se référer à un passage spécifique. Dans des cas comme celui-ci, votre langue peut utiliser le pluriel au lieu du singulier. Autre traduction : "les Écritures disent"

JAS	4	5	j258	figs-personification	ἡ Γραφὴ λέγει	1	the Scripture says	Jacques parle de la Bible au sens figuré, comme si elle pouvait parler toute seule. Traduction alternative : "il est écrit dans les Écritures" ou "nous pouvons lire dans les Écritures" (Voir : [[rc://fr/ta/man/translate/figs-personification]])

JAS	4	5	bx68		πρὸς φθόνον ἐπιποθεῖ τὸ Πνεῦμα ὃ κατῴκισεν ἐν ἡμῖν	1	The Spirit whom he caused to live in us longs with jealousy	Ici, **> Esprit <** pourrait signifier : (1) le Saint-Esprit, qui pourrait être le sujet du verbe **> envie <**> . L'idée que l'Esprit soit jaloux s'accorderait avec la métaphore de l'adultère dans le verset précédent. Traduction alternative : "L'Esprit que Dieu a fait habiter en nous désire ardemment que nous vivions fidèlement à Dieu" (2) le Saint-Esprit, qui pourrait être l'objet du verbe **> désire <**> , auquel cas Dieu serait le sujet de ce verbe. Cette interprétation s'accorderait également avec la métaphore de l'adultère. Traduction alternative : "(3) l'esprit humain, auquel cas la déclaration répéterait ce que Jacques a dit dans [4:2](../04/02.md) au sujet des gens qui convoitent et envient. Traduction alternative : "L'esprit que Dieu a fait vivre en nous désire jalousement des choses qu'il ne possède pas".

JAS	4	5	j259	writing-pronouns	ὃ κατῴκισεν ἐν ἡμῖν	1	whom he caused to live in us	Quelle que soit l'interprétation de la phrase entière, le pronom **il** dans cette clause fait référence à Dieu. Traduction alternative : "que Dieu a fait vivre en nous" (Voir : [[rc://fr/ta/man/translate/writing-pronouns]])

JAS	4	6	ub8z	figs-explicit	μείζονα δὲ δίδωσιν χάριν	1	But he gives greater grace	À la lumière de ce qu'il dit dans les deux versets précédents, Jacques établit un contraste entre ce que l'on pourrait attendre de Dieu et ce qu'il fait réellement. Si cela peut être utile à vos lecteurs, vous pourriez énoncer ce contraste de manière plus explicite. Traduction alternative : "Mais même si Dieu est jaloux si nous sommes amis avec le monde, il ne nous rejette pas. Au contraire, il nous donne encore plus de grâce pour être amis avec lui" (Voir : [[rc://fr/ta/man/translate/figs-explicit]])

JAS	4	6	j260	writing-pronouns	μείζονα δὲ δίδωσιν χάριν	1	But he gives greater grace	Le pronom **il** se réfère à Dieu. Traduction alternative : "Mais Dieu fait plus de grâce" (Voir : [[rc://fr/ta/man/translate/writing-pronouns]])

JAS	4	6	j261		μείζονα…χάριν	1	greater grace	Le comparatif **> plus grand <** fait référence à la quantité plutôt qu'à la taille. Traduction alternative : "encore plus de grâce"

JAS	4	6	hyh2	writing-pronouns	διὸ λέγει	1	Therefore it says	Le pronom **il** fait référence à l'Écriture, l'antécédent du verset précédent. Même si Jacques cite maintenant un passage spécifique, [Proverbes 3:34](../pro/03/34.md), plutôt qu'un enseignement général, la référence est à la Bible dans son ensemble. Traduction alternative : "C'est pourquoi l'Écriture dit" ou "C'est pourquoi les Écritures disent" (Voir : [[rc://fr/ta/man/translate/writing-pronouns]])

JAS	4	6	j262	figs-personification	λέγει	1	it says	Jacques parle de la Bible au sens figuré, comme si elle pouvait parler toute seule. Traduction alternative : "il est écrit dans les Écritures" ou "nous pouvons lire dans les Écritures" (Voir : [[rc://fr/ta/man/translate/figs-personification]])

JAS	4	6	qs61	figs-nominaladj	ὑπερηφάνοις…ταπεινοῖς	1	the proud … the humble	Jacques utilise les adjectifs **fier** et **humble** comme noms pour désigner des types de personnes. Votre langue utilise peut-être les adjectifs de la même manière. Si ce n'est pas le cas, vous pouvez les traduire par des expressions équivalentes. Traduction alternative : "proud people ... humble people" (Voir : [[rc://fr/ta/man/translate/figs-nominaladj]])

JAS	4	7	g7e5	figs-activepassive	ὑποτάγητε οὖν	1	Be submitted, therefore	Si votre langue n'utilise pas cette forme passive, vous pouvez l'exprimer avec une forme active. Traduction alternative : "Soumettre, donc" (Voir : [[rc://fr/ta/man/translate/figs-activepassive]])

JAS	4	7	da5t	grammar-connect-logic-result	ὑποτάγητε οὖν	1	Be submitted, therefore	Jacques donne la raison du résultat qu'il a décrit dans le verset précédent. Traduction alternative : " Parce que Dieu fait grâce aux humbles, soyez soumis " ou " Parce que Dieu fait grâce aux humbles, soumettez-vous " (Voir : [[rc://fr/ta/man/translate/grammar-connect-logic-result]]).

JAS	4	7	j263	grammar-connect-logic-result	ἀντίστητε δὲ τῷ διαβόλῳ, καὶ φεύξεται ἀφ’ ὑμῶν	1	But resist the devil, and he will flee from you	Jacques utilise le mot traduit **et** pour décrire un résultat. Traduction alternative : "Mais résistez au diable. Si vous le faites, il fuira loin de vous" (Voir : [[rc://fr/ta/man/translate/grammar-connect-logic-result]])

JAS	4	7	nud3		ἀντίστητε…τῷ διαβόλῳ	1	resist the devil	Traduction alternative : "se résoudre à ne pas faire ce que le diable veut"

JAS	4	7	w9ue	figs-metaphor	φεύξεται ἀφ’ ὑμῶν	1	he will flee from you	Jacques parle au sens figuré du diable comme s'il fuyait un croyant qui lui résiste après s'être humilié devant Dieu. Traduction alternative : "il cessera d'essayer de vous faire faire ce qu'il veut" (Voir : [[rc://fr/ta/man/translate/figs-metaphor]])

JAS	4	8	j264	grammar-connect-logic-result	ἐγγίσατε τῷ Θεῷ, καὶ ἐγγιεῖ ὑμῖν	1	Come near to God and he will come near to you	Jacques utilise le mot traduit **et** pour décrire un résultat. Autre traduction : "Si vous vous approchez de Dieu, alors il s'approchera de vous" (Voir : [[rc://fr/ta/man/translate/grammar-connect-logic-result]])

JAS	4	8	g62m	figs-metaphor	ἐγγίσατε τῷ Θεῷ, καὶ ἐγγιεῖ ὑμῖν	1	Come near to God and he will come near to you	Jacques utilise une métaphore spatiale pour décrire deux personnes entretenant une bonne relation comme si elles étaient **proches** l'une de l'autre. Traduction alternative : " Faites votre part pour avoir une bonne relation avec Dieu, et vous trouverez que Dieu veut aussi avoir une bonne relation avec vous " (Voir : [[rc://fr/ta/man/translate/figs-metaphor]]).

JAS	4	8	j265	figs-metaphor	καθαρίσατε χεῖρας	1	Cleanse your hands	Jacques utilise l'image du lavage des mains pour décrire une personne qui élimine le péché de sa vie. Traduction alternative : "Arrêtez de pécher" (Voir : [[rc://fr/ta/man/translate/figs-metaphor]])

JAS	4	8	elh1	figs-metonymy	καθαρίσατε χεῖρας	1	Cleanse your hands	Jacques utilise le mot **mains** au sens figuré pour signifier des actions, par association avec la façon dont les gens utilisent leurs mains pour faire des choses. Traduction alternative : "Arrêtez de faire des choses qui sont mauvaises" (Voir : [[rc://fr/ta/man/translate/figs-metonymy]])

JAS	4	8	j266		ἁμαρτωλοί	1	sinners	Jacques s'adresse à ses lecteurs au vocatif. Si votre langue possède un vocatif, il serait approprié de l'utiliser ici. Sinon, vous pourriez exprimer le sens d'une autre manière qui serait naturelle dans votre langue. Autre traduction : "vous, pécheurs"

JAS	4	8	j267	figs-metaphor	ἁγνίσατε καρδίας	1	purify your hearts	Jacques dit **cœurs** au sens figuré pour signifier les pensées et les désirs des gens. Traduction alternative : "purifiez vos pensées et vos désirs" (Voir : [[rc://fr/ta/man/translate/figs-metaphor]])

JAS	4	8	mw54	figs-metaphor	ἁγνίσατε καρδίας	1	purify your hearts	Le terme **purifier** fait référence à une purification cérémoniale qui permet à une personne de participer à des activités religieuses. Jacques parle au sens figuré comme si les **cœurs** de ses lecteurs pouvaient être purifiés de cette manière. Traduction alternative : " Assurez-vous que vous ne pensez ou ne désirez rien de mal " (Voir : [[rc://fr/ta/man/translate/figs-metaphor]]).

JAS	4	8	j268	figs-nominaladj	δίψυχοι	1	double-minded	Jacques utilise l'adjectif **double d'esprit** comme un nom pour faire référence à un type de personne. Votre langue utilise peut-être les adjectifs de la même manière. Si ce n'est pas le cas, vous pouvez le traduire par une expression équivalente. Traduction alternative : "double-minded people" (Voir : [[rc://fr/ta/man/translate/figs-nominaladj]])

