18:30	wp50				Que fait le serviteur avec son compagnon de service qui lui doit cent deniers ?	Le serviteur refuse d'être patient et jette son compagnon de service en prison.

18:33	y07y				Qu'est-ce que le maître a dit au serviteur qu'il aurait dû faire avec son compagnon de service ?	Le maître a dit au serviteur qu'il aurait dû avoir pitié de son compagnon de service.

18:34	ev6y				Que fit alors le maître au serviteur ?	Le maître livrait le serviteur aux tortionnaires jusqu'à ce qu'il paie tout ce qui lui était dû.

18:35	epl6				Qu'est-ce que Jésus a dit que le Père fera si nous ne pardonnons pas notre frère de tout notre cœur ?	Jésus a dit que le Père nous fera comme le maître a fait au serviteur si nous ne pardonnons pas notre frère du fond du cœur.

19:3	upfq				Quelle question les Pharisiens ont-ils posée à Jésus pour le tester ?	Les pharisiens demandèrent à Jésus : "Est-il permis à un homme de répudier sa femme pour quelque motif que ce soit ?"

19:4	h71o				Qu'est-ce que Jésus a dit qui était vrai depuis le début de la création ?	Jésus a dit que, dès le début de la création, Dieu les avait faits homme et femme.

19:5	f48m				En raison de la façon dont Dieu les a faits homme et femme, qu'est-ce que Jésus a dit qu'un homme devait faire ?	Jésus a dit que l'homme doit quitter son père et sa mère et s'attacher à sa femme.

19:5-6	jim7				Qu'est-ce que Jésus a dit qu'il se passe quand le mari s'unit à sa femme ?	Jésus a dit que lorsqu'un mari s'unit à sa femme, les deux deviennent une seule chair.

19:6	pcrs				Qu'est-ce que Jésus a dit que l'homme ne devait pas faire de ce que Dieu a uni ?	Jésus a dit que l'homme ne doit pas déchirer ce que Dieu a uni.

19:7-8	w0b2				Pourquoi Jésus a-t-il dit que Moïse avait ordonné des certificats de divorce ?	Jésus a dit que Moïse avait ordonné des certificats de divorce à cause de la dureté du cœur des Juifs.

19:9	gln0				Qui, selon Jésus, commet l'adultère ?	Jésus a dit que quiconque répudie sa femme, sauf pour fornication, et en épouse une autre commet un adultère, et que l'homme qui épouse une femme divorcée commet un adultère.

19:10-12	zws5				Qui, selon Jésus, pourrait accepter d'être un eunuque ?	Jésus a dit que ceux qui sont autorisés à l'accepter peuvent accepter d'être un eunuque.

19:13	cmel				Qu'ont fait les disciples lorsque des petits enfants ont été amenés à Jésus ?	Lorsque des petits enfants ont été amenés à Jésus, les disciples les ont réprimandés.

19:14	sme3				Qu'a dit Jésus en voyant les petits enfants ?	Jésus a dit de laisser venir les petits enfants, car c'est à ceux-là qu'appartient le royaume des cieux.

19:16-17	i057				Qu'est-ce que Jésus a dit au jeune homme qu'il devait faire pour entrer dans la vie éternelle ?	Jésus a dit à l'homme de garder les commandements pour entrer dans la vie éternelle.

19:20-21	lrcn				Quand le jeune homme a dit qu'il avait gardé les commandements, qu'est-ce que Jésus lui a dit de faire ?	Quand le jeune homme a dit qu'il avait gardé les commandements, Jésus lui a dit de vendre ce qu'il avait et de le donner aux pauvres.

19:22	xq1c				Comment le jeune homme a-t-il répondu au commandement de Jésus de vendre ce qu'il avait ?	Le jeune homme s'en alla tout triste parce qu'il avait de grands biens.

19:26	d7c1				Qu'a dit Jésus sur la possibilité pour un homme riche d'entrer dans le royaume des cieux ?	Jésus a dit qu'avec les hommes, tout est impossible, mais qu'avec Dieu, tout est possible.

19:28	cw1n				Quelle récompense Jésus a-t-il promis à ses disciples qui l'avaient suivi ?	Jésus a promis à ses disciples que dans la nouvelle naissance, ils seraient assis sur 12 trônes, jugeant les 12 tribus d'Israël.

19:30	rna9				Qu'a dit Jésus à propos de ceux qui sont les premiers maintenant et ceux qui sont les derniers maintenant ?	Jésus a dit que ceux qui sont les premiers maintenant seront les derniers, et que ceux qui sont les derniers maintenant seront les premiers.

20:1-2	wh43				Combien le propriétaire foncier a-t-il accepté de payer les ouvriers qu'il a embauchés tôt le matin ?	Le propriétaire accepte de payer un denier par jour aux ouvriers embauchés tôt le matin.

20:4	qu3w				Combien le propriétaire a-t-il dit qu'il paierait les ouvriers qu'il a embauchés la troisième heure ?	Le propriétaire du terrain a dit qu'il leur paierait ce qui est juste.

20:9	q74p				Combien ont reçu les travailleurs qui ont été embauchés à la onzième heure ?	Les ouvriers embauchés à la onzième heure ont reçu un denier.

20:11-12	ay0a				De quoi se plaignaient les ouvriers qui étaient embauchés tôt le matin ?	Ils se sont plaints d'avoir travaillé toute la journée, mais d'avoir reçu le même salaire que ceux qui ont travaillé une heure.

20:13-14	u4vf				Comment le propriétaire a-t-il répondu à la plainte des travailleurs ?	Le propriétaire a déclaré qu'il n'avait fait aucun tort aux travailleurs et qu'il leur avait payé ce qui leur appartenait.

20:17-19	ley8				Quels sont les événements dont Jésus a parlé à l'avance à ses disciples alors qu'ils montaient à Jérusalem ?	Jésus a dit à ses disciples qu'il serait livré aux grands prêtres et aux scribes, condamné à mort, crucifié et ressuscité le troisième jour.

20:20-21	ce1w				Quelle demande la mère des fils de Zébédée avait-elle pour Jésus ?	Elle voulait que Jésus ordonne que ses deux fils soient assis à sa droite et à sa gauche dans son royaume.

20:23	xm2k				Qui, selon Jésus, a déterminé qui serait assis à sa droite et à sa gauche dans son royaume ?	Jésus a dit que le Père a préparé ces lieux pour ceux qu'il a choisis.

20:26	uvlv				Comment Jésus a-t-il dit que l'on pouvait être grand parmi ses disciples ?	Jésus a dit que celui qui veut devenir grand doit être un serviteur.

20:28	i680				Pourquoi Jésus a-t-il dit qu'il était venu ?	Jésus a dit qu'il était venu pour servir et donner sa vie en rançon pour beaucoup.

20:30	p39w				Que firent les deux aveugles qui étaient assis au bord de la route lorsque Jésus passa ?	Les deux aveugles s'écrient : "Seigneur, Fils de David, aie pitié de nous".

20:34	mxpe				Pourquoi Jésus a-t-il guéri les deux aveugles ?	Jésus a guéri les deux aveugles parce qu'il était ému de compassion.

21:2	bydy				Qu'est-ce que Jésus a dit que ses deux disciples trouveraient dans le village en face d'eux ?	Jésus dit qu'ils trouveront une ânesse attachée, et un ânon avec elle.

21:4-5	hb5j				Qu'avait prédit un prophète à propos de cet événement ?	Un prophète a prédit que le Roi viendrait sur un âne, et sur un ânon.

21:8	a9sc				Qu'est-ce que la foule a fait à la route de Jérusalem que Jésus a empruntée ?	La plupart des gens de la foule étendirent leurs vêtements de dessus sur la route, et d'autres répandirent des branches d'arbres sur la route.

21:9	jb0b				Qu'est-ce que la foule a crié lorsque Jésus est parti ?	La foule criait : "Hosanna au fils de David, béni soit celui qui vient au nom du Seigneur, hosanna au plus haut des cieux".

21:12	g1ap				Qu'a fait Jésus lorsqu'il est entré dans le temple de Dieu à Jérusalem ?	Jésus a chassé tous ceux qui achetaient et vendaient dans le temple, il a renversé les tables des changeurs et les sièges de ceux qui vendaient des pigeons.

21:13	j9me				Qu'est-ce que Jésus a dit que les marchands avaient fait du temple de Dieu ?	Jésus a dit que les marchands avaient fait du temple de Dieu une caverne de voleurs.

21:15-16	ekwk				Lorsque les chefs des prêtres et les scribes se sont opposés à ce que les enfants criaient sur Jésus, que leur a répondu Jésus ?	Jésus a cité le prophète qui a dit que c'est de la bouche des enfants et des nourrissons que Dieu a fait sortir la louange.

21:18-19	vx5n				Qu'est-ce que Jésus a fait au figuier, et pourquoi ?	Jésus a fait sécher le figuier parce qu'il n'avait pas de fruits.

21:20-22	occs				Qu'est-ce que Jésus a enseigné à ses disciples sur la prière à partir du dessèchement du figuier ?	Jésus a enseigné à ses disciples que s'ils demandaient en prière tout en croyant, ils recevraient.

21:23	a13v				Pendant que Jésus enseignait, sur quoi les chefs des prêtres et les anciens l'ont-ils interrogé ?	Les chefs des prêtres et les anciens voulaient savoir par quelle autorité Jésus faisait ces choses.

21:25	u65g				Quelle question Jésus a-t-il posée en retour aux chefs des prêtres et aux anciens ?	Jésus leur demanda s'ils pensaient que le baptême de Jean le Baptiste venait du ciel ou des hommes.

21:25	efdz				Pourquoi les chefs des prêtres et les scribes ne voulaient-ils pas répondre que le baptême de Jean venait du ciel ?	Ils savaient que Jésus leur demanderait alors pourquoi ils ne croyaient pas Jean.

21:26	z8vl				Pourquoi les chefs des prêtres et les scribes ne voulaient-ils pas répondre que le baptême de Jean venait des hommes ?	Ils craignaient la foule, qui tenait Jean pour un prophète.

21:28-29	hzq0				Dans l'histoire des deux fils de Jésus, que fait le premier fils quand on lui dit de travailler à la vigne ?	Le premier fils a dit qu'il n'irait pas, mais il a changé d'avis et y est allé.

21:30	a2p2				Qu'a fait le deuxième fils quand on lui a dit de travailler à la vigne ?	Le deuxième fils a dit qu'il irait, mais il n'est pas allé.

21:31	cp5g				Lequel des deux fils a fait la volonté du père ?	Le premier fils.

21:31-32	o00x				Pourquoi Jésus a-t-il dit que les collecteurs d'impôts et les prostituées entraient dans le royaume de Dieu avant les chefs des prêtres et les scribes ?	Jésus a dit qu'ils entraient dans le royaume parce qu'ils croyaient Jean, mais les chefs des prêtres et les scribes ne croyaient pas Jean.

21:35-36	bdwj				Que faisaient les vignerons aux serviteurs que le propriétaire envoyait chercher son raisin ?	Les vignerons battaient, tuaient et lapidaient les serviteurs.

21:37	p7ww				Qui le propriétaire a-t-il finalement envoyé chez les vignerons ?	Le propriétaire a finalement envoyé son propre fils.

21:38-39	uvk8				Qu'ont fait les vignerons à la personne que le propriétaire a envoyée en dernier ?	Les vignerons ont tué le fils du propriétaire.

21:40-41	sgs8				Qu'est-ce que le peuple a dit que le propriétaire devait faire ?	Les gens disaient que le propriétaire devait détruire les premiers vignerons et ensuite louer à d'autres vignerons qui paieraient.

21:42	o8w1				Dans les Écritures que Jésus a ensuite citées, qu'arrive-t-il à la pierre que les bâtisseurs rejettent ?	La pierre que les bâtisseurs ont rejetée est devenue la pierre angulaire.

21:43	j3da				D'après l'Écriture que Jésus a citée, qu'a-t-il dit qu'il arriverait ?	Jésus a dit que le royaume de Dieu serait enlevé aux chefs des prêtres et aux pharisiens, et qu'il serait donné à une nation qui porte ses fruits.

21:46	hwd4				Pourquoi les chefs des prêtres et les pharisiens n'ont-ils pas immédiatement imposé les mains à Jésus ?	Ils avaient peur de la foule, car le peuple considérait Jésus comme un prophète.

22:5-6	mrha				Que firent les personnes invitées aux noces du fils du roi lorsque les serviteurs du roi apportèrent l'invitation ?	Certains n'ont pas pris l'invitation au sérieux et ont vaqué à leurs occupations, d'autres ont porté la main sur les serviteurs du roi et les ont tués.

22:7	vjyo				Qu'a fait le roi aux premiers invités au festin des noces ?	Le roi a envoyé ses armées, a tué ces meurtriers et a brûlé leur ville.

22:9-10	pfst				Qui le roi a-t-il ensuite invité à la fête de mariage ?	Le roi invita alors autant de personnes que ses serviteurs purent trouver, qu'elles soient bonnes ou mauvaises.

22:13	zdgl				Qu'a fait le roi à l'homme qui est venu au festin sans vêtement de noces ?	Le roi l'a fait attacher et jeter dans les ténèbres.

22:15	a2xx				Que tentaient de faire les Pharisiens à Jésus ?	Les Pharisiens essayaient de piéger Jésus dans son propre discours.

22:17	tavb				Quelle question les disciples des Pharisiens ont-ils posée à Jésus ?	Ils demandèrent à Jésus s'il était licite ou non de payer des impôts à César.

22:21	o4ol				Comment Jésus a-t-il répondu à la question des disciples des Pharisiens ?	Jésus a dit de donner à César ce qui est à César, et à Dieu ce qui est à Dieu.

22:23	f1ch				Quelle croyance les Sadducéens avaient-ils au sujet de la résurrection ?	Les Sadducéens croyaient qu'il n'y avait pas de résurrection.

22:26-27	hb95				Dans l'histoire des Sadducéens, combien de maris la femme a-t-elle eus ?	Cette femme a eu sept maris.

22:29	kay8				Quelles sont les deux choses que Jésus a dit que les sadducéens ne savaient pas ?	Jésus a dit que les sadducéens ne connaissaient pas les Écritures ni la puissance de Dieu.

22:30	bwx9				Qu'a dit Jésus sur le mariage dans la résurrection ?	Jésus a dit que dans la résurrection, il n'y a pas de mariage.

22:32	sbnq				Comment Jésus a-t-il montré, à partir des Écritures, qu'il y a une résurrection ?	Jésus a cité les Écritures où Dieu dit qu'il est le Dieu d'Abraham, d'Isaac et de Jacob - le Dieu des vivants.

22:36	v6nm				Quelle question le juriste pharisien a-t-il posée à Jésus ?	Le juriste demande à Jésus quel est le plus grand commandement de la loi.

22:37-38	mmi8				Quel est, selon Jésus, le grand et premier commandement ?	Jésus a dit que le grand et premier commandement était d'aimer le Seigneur ton Dieu de tout ton cœur, de toute ton âme et de tout ton esprit.

22:39	hd9d				Qu'est-ce que Jésus a dit être le deuxième commandement ?	Jésus a dit que le deuxième commandement était d'aimer son prochain comme soi-même.

22:42	hps5				Quelle question Jésus a-t-il posée aux Pharisiens ?	Jésus leur a demandé qui est le fils du Christ.

22:42	hsuj				Quelle réponse les Pharisiens ont-ils donnée à Jésus ?	Les Pharisiens ont dit que le Christ était le fils de David.

22:45	rsdv				Quelle est la deuxième question que Jésus a ensuite posée aux Pharisiens ?	Jésus leur demande alors comment David peut appeler son fils, le Christ, Seigneur.

22:46	n9o9				Quelle réponse les Pharisiens ont-ils donnée à Jésus ?	Les pharisiens n'ont pas été capables de répondre à Jésus par un mot.

23:2-3	cak5				Puisque les scribes et les pharisiens étaient assis sur le siège de Moïse, qu'est-ce que Jésus a dit aux gens de faire avec leur enseignement ?	Jésus a dit au peuple de faire et d'observer les choses que les scribes et les pharisiens enseignaient du siège de Moïse.

23:3	zftb				Pourquoi Jésus a-t-il dit que les gens ne devaient pas imiter les actions des scribes et des pharisiens ?	Jésus a dit qu'il ne fallait pas imiter leurs actes parce qu'ils disent des choses mais ne les font pas.

23:5	byyu				Dans quel but les scribes et les pharisiens ont-ils accompli toutes leurs actions ?	Les scribes et les pharisiens ont fait toutes leurs actions pour être vus par les gens.

23:8-10	gnun				Qui, selon Jésus, est notre seul Père et notre seul maître ?	Jésus a dit que notre seul Père est celui qui est dans les cieux, et que notre seul maître est le Christ.

23:12	j3tg				Que fera Dieu à celui qui s'élève, et à celui qui s'abaisse ?	Dieu humiliera celui qui s'élève et élèvera celui qui s'abaisse.

23:13-15	jrqj				Quel nom Jésus a-t-il donné à plusieurs reprises aux scribes et aux pharisiens pour décrire leur comportement ?	Jésus a traité à plusieurs reprises les scribes et les pharisiens d'hypocrites.

23:15	iwrs				Lorsque les scribes et les pharisiens ont fait un nouveau converti, de qui était-il le fils ?	Quand les scribes et les pharisiens faisaient un nouveau converti, il était deux fois plus fils de l'enfer qu'eux.

23:16-17	yilh				En ce qui concerne le fait d'être lié par des serments, qu'a dit Jésus à propos des enseignements des scribes et des pharisiens ?	Jésus a dit que les scribes et les pharisiens étaient des guides aveugles et des fous aveugles.

23:23	ep2a				Même s'ils avaient prélevé la dîme de la menthe, de l'aneth et du cumin, qu'est-ce que les scribes et les pharisiens avaient omis de faire ?	Les scribes et les pharisiens n'avaient pas fait ce qui était le plus important dans la loi - la justice, la miséricorde et la foi.

23:25-26	atfn				Qu'est-ce que les scribes et les pharisiens n'avaient pas réussi à nettoyer ?	Les scribes et les pharisiens n'avaient pas nettoyé l'intérieur de leur coupe, donc l'extérieur pouvait aussi être propre.

23:28	di7v				De quoi les scribes et les pharisiens étaient-ils pleins à l'intérieur ?	Les scribes et les pharisiens étaient pleins d'hypocrisie et d'anarchie.

23:29-31	max5				Qu'avaient fait les pères des scribes et des pharisiens aux prophètes de Dieu ?	Les pères des scribes et des pharisiens avaient tué les prophètes de Dieu.

23:33	aird				Quel jugement les scribes et les pharisiens allaient-ils subir ?	Les scribes et les pharisiens allaient subir le jugement de l'enfer.

23:34	ltnn				Qu'est-ce que Jésus a dit que les scribes et les pharisiens feraient aux prophètes, aux sages et aux scribes qu'il leur enverrait ?	Jésus a dit qu'ils tueraient et crucifieraient certains, qu'ils en fouetteraient d'autres et qu'ils en poursuivraient certains de ville en ville.

23:35	zix0				En raison de leur comportement, quel sentiment de culpabilité allait s'abattre sur les scribes et les pharisiens ?	La culpabilité de tout le sang juste versé sur la terre retomberait sur les scribes et les pharisiens.

23:36	dwou				A quelle génération Jésus a-t-il dit que toutes ces choses arriveraient ?	Jésus a dit que toutes ces choses arriveraient à cette génération.

23:37	zvar				Quel désir Jésus avait-il pour les enfants de Jérusalem, et pourquoi ne s'est-il pas réalisé ?	Jésus voulait rassembler les enfants de Jérusalem, mais ils ne voulaient pas se mettre d'accord.

23:38	qe8d				Comment la maison de Jérusalem serait-elle maintenant laissée ?	La maison de Jérusalem serait désormais laissée à l'abandon.

24:2	rqog				Qu'est-ce que Jésus a prophétisé concernant le temple de Jérusalem ?	Jésus a prophétisé qu'il ne resterait pas une pierre du temple sur une autre qui ne serait pas démolie.

24:3	pn60				Après avoir entendu la prophétie sur le temple, qu'ont demandé les disciples à Jésus ?	Les disciples demandèrent à Jésus quand ces choses allaient se produire, et quel serait le signe de sa venue et de la fin du monde ?

24:5	gjxz				Quelle est l'action des personnes dont Jésus a dit qu'elles égareraient beaucoup de monde ?	Jésus a dit que beaucoup viendraient en disant qu'ils sont le Christ, égarant beaucoup de gens.

24:6-8	v9o3				Quels sont les événements qui, selon Jésus, marqueront le début des douleurs de la naissance ?	Jésus a dit que les guerres, les famines et les tremblements de terre seraient le début des douleurs de la naissance.

24:9-10	i5dp				Qu'est-ce que Jésus a dit qu'il se produirait parmi les croyants à ce moment-là ?	Jésus a dit que les croyants subiraient des tribulations et seraient haïs par les nations à cause de son nom.

24:13	fsav				Qui, selon Jésus, sera sauvé ?	Jésus a dit que celui qui endure jusqu'à la fin sera sauvé.

24:14	d78h				Que se passera-t-il avec l'évangile avant la fin ?	L'évangile du royaume sera prêché dans le monde entier avant la fin.

24:15-18	bam0				Qu'est-ce que Jésus a dit aux croyants de faire lorsqu'ils verront l'abomination de la désolation se dresser dans le lieu saint ?	Jésus a dit que les croyants devaient fuir dans les montagnes.

24:21	ok6i				Quelle sera l'ampleur de la tribulation en ces jours-là ?	En ces jours-là, la tribulation sera grande, plus grande que toute autre depuis le commencement du monde.

24:24	iosc				Comment les faux Christs et les faux prophètes vont-ils égarer beaucoup de gens ?	Les faux Christs et les faux prophètes feront de grands signes et des prodiges pour égarer les gens.

24:27	oylw				À quoi ressemblera la venue du Fils de l'homme ?	La venue du Fils de l'homme ressemblera à un éclair brillant d'est en ouest.

24:29	eqyv				Qu'arrivera-t-il au soleil, à la lune et aux étoiles après la tribulation de ces jours-là ?	Le soleil et la lune s'obscurciront, et les étoiles tomberont du ciel.

24:30	kqot				Que feront les tribus de la terre lorsqu'elles verront le Fils de l'homme venir en puissance et en grande gloire ?	Les tribus de la terre seront en deuil.

24:31	y4r6				Quel bruit se fera entendre lorsque le Fils de l'homme enverra ses anges pour rassembler les élus ?	Le grand son de la trompette se fera entendre lorsque les anges rassembleront les élus.

24:34	vz5z				Qu'est-ce que Jésus a dit qui ne passerait pas avant que toutes ces choses aient eu lieu ?	Jésus a dit que cette génération ne passera pas avant que toutes ces choses ne se soient produites.

24:35	f996				Qu'est-ce que Jésus a dit qui passerait, et qu'est-ce qui ne passerait jamais ?	Jésus a dit que le ciel et la terre passeront, mais que ses paroles ne passeront jamais.

24:36	qpf2				Qui sait quand ces événements se produiront ?	Seul le Père sait quand ces événements se produiront.

24:37-39	mys9				Comment la venue du Fils de l'homme sera-t-elle semblable à l'époque de Noé avant le déluge ?	Les gens mangeront et boiront, se marieront et donneront en mariage, ne sachant rien du jugement à venir qui les emportera.

24:42	mer1				Quelle attitude Jésus a-t-il dit que ses croyants devaient adopter face à sa venue, et pourquoi ?	Jésus a dit que ses croyants doivent toujours être prêts, car ils ne savent pas quel jour le Seigneur viendra.

24:45-46	ien5				Que fait un serviteur fidèle et sage pendant l'absence de son maître ?	Un serviteur fidèle et avisé s'occupe de la maison de son maître pendant l'absence de ce dernier.

24:47	l3jp				Que fait le maître pour le serviteur fidèle et sage à son retour ?	À son retour, le maître place le serviteur fidèle et sage sur tout ce qu'il possède.

24:48-49	zsw7				Que fait un mauvais serviteur pendant que le maître est absent ?	Un mauvais serviteur bat ses compagnons de service et mange et boit avec les ivrognes pendant l'absence du maître.

24:51	oi2q				Que fait le maître avec le mauvais serviteur quand il revient ?	Quand il revient, le maître coupe en morceaux le mauvais serviteur et l'envoie là où il y a des pleurs et des grincements de dents.

25:3	qwia				Que n'ont pas fait les vierges folles lorsqu'elles sont allées à la rencontre de l'époux ?	Les vierges folles n'ont pas pris d'huile avec leurs lampes.

25:4	d1tc				Que faisaient les vierges sages lorsqu'elles allaient à la rencontre de l'époux ?	Les vierges sages ont pris des récipients d'huile avec leurs lampes.

25:5-6	a6xq				Quand l'époux est-il venu, et était-ce le moment attendu ?	L'époux est arrivé à minuit, ce qui était plus tard que l'heure prévue.

25:10	zyqf				Qu'est-il arrivé aux vierges sages quand l'époux est arrivé ?	Les vierges sages ont accompagné l'époux au festin des noces.

25:10-12	bol5				Qu'est-il arrivé aux vierges folles quand l'époux est arrivé ?	Les vierges folles devaient aller acheter de l'huile et, à leur retour, la porte du festin leur était fermée.

25:13	q8i0				Qu'est-ce que Jésus a dit qu'il voulait que les croyants apprennent de la parabole des vierges ?	Jésus dit que les croyants doivent veiller, car ils ne connaissent ni le jour ni l'heure.

25:16	z8rc				Qu'ont fait les serviteurs aux cinq et deux talents avec leurs talents lorsque leur maître est parti en voyage ?	Le serviteur qui avait cinq talents en a fait cinq autres, et celui qui avait deux talents en a fait deux autres.

25:18	m2j8				Qu'a fait le serviteur d'un talent lorsque son maître est parti en voyage ?	Le serviteur qui avait un talent a creusé un trou dans le sol et a caché l'argent de son maître.

25:19	hfww				Combien de temps le maître est-il parti en voyage ?	Le maître a été absent pendant un long moment.

25:20-21	ikbp				À son retour, que fit le maître pour les serviteurs qui avaient reçu cinq et deux talents ?	Le maître a dit : "Bravo, bon et fidèle serviteur !" et leur a confié de nombreuses responsabilités.

25:26	o2vg				À son retour, qu'a fait le maître au serviteur qui avait reçu un talent ?	Le maître dit : "Serviteur méchant et paresseux", lui enleva le talent et le jeta dans les ténèbres extérieures.

25:31-32	sd2y				Que fera le Fils de l'homme quand il viendra s'asseoir sur son trône glorieux ?	Le Fils de l'homme rassemblera toutes les nations et séparera les peuples les uns des autres.

25:34	wqx8				Que recevront ceux qui sont à la droite du Roi ?	Ceux qui sont à la droite du Roi reçoivent le royaume préparé pour eux dès la fondation du monde.

25:35-36	k3gd				Qu'ont fait ceux qui étaient à la droite du Roi dans leur vie ?	Ceux qui étaient à la droite du roi donnaient à manger aux affamés, à boire aux assoiffés, accueillaient les étrangers, habillaient ceux qui étaient nus, soignaient les malades et visitaient les prisonniers.

25:41	e7j3				Que recevront ceux qui sont à la gauche du Roi ?	Ceux qui sont à la gauche du Roi reçoivent le feu éternel préparé pour le diable et ses anges.

25:42-43	igr1				Qu'est-ce que ceux qui étaient à la gauche du roi n'ont pas fait dans leur vie ?	Ceux qui étaient à la gauche du roi ne donnaient pas à manger aux affamés, ne buvaient pas aux assoiffés, n'accueillaient pas les étrangers, ne vêtaient pas ceux qui étaient nus, ne soignaient pas les malades et ne visitaient pas les prisonniers.

26:2	rcj7				Quelle est la fête juive dont Jésus a dit qu'elle arrivait dans deux jours ?	Jésus a dit que la Pâque venait dans deux jours.

